Symbol,AssetType,Name,Description,CIK,Exchange,Currency,Country,Sector,Industry,Address,OfficialSite,FiscalYearEnd,LatestQuarter,MarketCapitalization,EBITDA,PERatio,PEGRatio,BookValue,DividendPerShare,DividendYield,EPS,RevenuePerShareTTM,ProfitMargin,OperatingMarginTTM,ReturnOnAssetsTTM,ReturnOnEquityTTM,RevenueTTM,GrossProfitTTM,DilutedEPSTTM,QuarterlyEarningsGrowthYOY,QuarterlyRevenueGrowthYOY,AnalystTargetPrice,AnalystRatingStrongBuy,AnalystRatingBuy,AnalystRatingHold,AnalystRatingSell,AnalystRatingStrongSell,TrailingPE,ForwardPE,PriceToSalesRatioTTM,PriceToBookRatio,EVToRevenue,EVToEBITDA,Beta,52WeekHigh,52WeekLow,50DayMovingAverage,200DayMovingAverage,SharesOutstanding,DividendDate,ExDividendDate,PricePerShare
EXR,Common Stock,Extra Space Storage Inc,"Extra Space Storage is a real estate investment trust headquartered in Cottonwood Heights, Utah that invests in self storage units.",1289490,NYSE,USD,USA,REAL ESTATE & CONSTRUCTION,REAL ESTATE INVESTMENT TRUSTS,"2795 COTTONWOOD PARKWAY, SUITE 400, SALT LAKE CITY, UT, US",https://www.extraspace.com,December,2024-09-30,34074468000,2260791000,41.2,4.817,66.09,6.48,0.0416,3.75,15.65,0.244,0.46,0.0333,0.0557,3311251000,1515898000,3.75,-0.051,0.12,173.89,3,3,11,0,2,41.2,30.12,10.29,2.337,13.89,19.95,0.886,182.98,126.94,166.2,158.67,211984000,2024-12-31,2024-12-16,160.74
RMD,Common Stock,ResMed Inc,"ResMed is a San Diego, California-based medical equipment company. It primarily provides cloud-connectable medical devices for the treatment of sleep apnea (such as CPAP devices and masks), chronic obstructive pulmonary disease (COPD), and other respiratory conditions.",943819,NYSE,USD,USA,LIFE SCIENCES,SURGICAL & MEDICAL INSTRUMENTS & APPARATUS,"9001 SPECTRUM CENTER BLVD., SAN DIEGO, CA, US",https://www.resmed.com,June,2024-09-30,35615646000,1632186000,32.14,1.841,35.39,1.97,0.0087,7.55,32.71,0.232,0.316,0.133,0.236,4807485000,2386058000,7.55,0.416,0.111,253.11,3,5,6,1,0,32.14,26.53,7.41,6.86,7.5,22.17,0.687,259.93,162.6,242.59,218.94,146796000,2024-12-12,2024-11-07,242.62
MTB,Common Stock,M&T Bank Corporation,"M&T Bank Corporation is an American bank holding company headquartered in Buffalo, New York.",36270,NYSE,USD,USA,FINANCE,STATE COMMERCIAL BANKS,"C/O CORPORATE REPORTING, ONE M&T PLAZA 5TH FLOOR, BUFFALO, NY, US",https://www3.mtb.com,December,2024-09-30,32545401000,None,14.52,1.367,159.39,5.3,0.0275,13.51,51.04,0.281,0.428,0.0114,0.0868,8499000000,7661559000,13.51,0.01,0.012,225.03,4,7,7,1,1,14.52,12.21,3.829,1.229,5.35,-,0.732,224.31,124.22,202.62,166.76,165921000,2024-12-31,2024-12-02,196.15
IRM,Common Stock,Iron Mountain Incorporated,"Iron Mountain Inc. (NYSE: IRM) is an American enterprise information management services company founded in 1951 and headquartered in Boston, Massachusetts.",1020569,NYSE,USD,USA,REAL ESTATE & CONSTRUCTION,REAL ESTATE INVESTMENT TRUSTS,"ONE FEDERAL STREET, BOSTON, MA, US",https://www.ironmountain.com,December,2024-09-30,32307010000,2001980000,305.81,1.08,-0.883,2.634,0.0257,0.36,20.44,0.0175,0.196,0.0422,0.544,5988459000,2914454000,0.36,308.28,0.122,122.38,5,2,0,1,0,305.81,72.99,5.39,1516.51,8.07,27.96,1.023,129.41,62.89,119.91,99.65,293460000,2025-01-07,2024-12-16,110.09
SLF,Common Stock,Sun Life Financial Inc.,"Sun Life Financial Inc., a financial services company, provides insurance, wealth and asset management solutions to individuals and corporate clients around the world. The company is headquartered in Toronto, Canada.",1097362,NYSE,USD,USA,FINANCE,LIFE INSURANCE,"SUN LIFE ASSURANCE CO OF CANADA, ONE YORK STREET, TORONTO, ON, CA",https://www.sunlife.com,December,2024-09-30,34330067000,5277000000,13.84,1.331,40.95,3.18,0.0398,4.3,55.99,0.112,0.207,0.0089,0.151,32559000000,14476000000,4.3,0.567,0.077,47.42,4,4,5,0,1,13.84,11.26,1.054,1.932,0.991,-,0.939,62.85,45.45,59.06,53.81,575703000,2024-12-31,2024-11-27,59.63
HUM,Common Stock,Humana Inc,"Humana Inc. is a for-profit American health insurance company based in Louisville, Kentucky.",49071,NYSE,USD,USA,FINANCE,HOSPITAL & MEDICAL SERVICE PLANS,"500 W MAIN ST, LOUISVILLE, KY, US",https://www.humana.com,December,2024-09-30,28162929000,3779000000,20.41,1.072,145.88,3.54,0.0136,11.46,949.93,0.0118,0.0266,0.0401,0.0784,115010003000,17180000000,11.46,-0.407,0.113,288.8,1,6,18,0,0,20.41,13.57,0.245,1.603,0.314,-,0.52,471.33,213.31,273.38,326.51,120411000,2025-01-31,2024-12-31,233.89
IDXX,Common Stock,IDEXX Laboratories Inc,"IDEXX Laboratories, Inc. is an American multinational corporation  engaged in the development, manufacture, and distribution of products and services for the companion animal veterinary, livestock and poultry, water testing, and dairy markets.",874716,NASDAQ,USD,USA,LIFE SCIENCES,IN VITRO & IN VIVO DIAGNOSTIC SUBSTANCES,"ONE IDEXX DRIVE, WESTBROOK, ME, US",https://www.idexx.com,December,2024-09-30,34972140000,1299420000,41.15,4.495,19.72,None,None,10.38,46.45,0.225,0.375,0.228,0.594,3844817000,2004338000,10.38,0.107,0.066,478.62,4,2,5,0,2,41.15,37.74,9.1,21.61,9.28,28.48,1.357,583.39,398.5,439.71,484.78,81885000,None,None,427.09
CCEP,Common Stock,Coca-Cola European Partners PLC,"Coca-Cola Europacific Partners PLC produces, distributes and sells a variety of ready-to-drink non-alcoholic beverages. The company is headquartered in Uxbridge, the United Kingdom.",1650107,NASDAQ,USD,USA,MANUFACTURING,BOTTLED & CANNED SOFT DRINKS & CARBONATED WATERS,"PEMBERTON HOUSE, BAKERS ROAD, UXBRIDGE, GB",https://www.cocacolaep.com,December,2024-06-30,36432523000,2948000000,21.07,1.916,18.52,1.91,0.027,3.68,41.64,0.0842,0.118,0.048,0.194,19153000000,6232000000,3.68,-0.07,0.095,82.35,2,8,2,0,1,21.07,16.86,1.902,3.987,2.354,14.06,0.764,80.92,62.48,77.45,74.86,460947000,2024-12-03,2024-11-15,79.04
HIG,Common Stock,Hartford Financial Services Group,"The Hartford Financial Services Group, Inc., usually known as The Hartford, is a United States-based investment and insurance company.",874766,NYSE,USD,USA,FINANCE,"FIRE, MARINE & CASUALTY INSURANCE","ONE HARTFORD PLAZA, HARTFORD, CT, US",https://www.thehartford.com,December,2024-09-30,31612615000,4254000000,10.96,1.41,57.34,1.88,0.0188,9.95,87.92,0.116,0.149,0.0317,0.197,26084000000,7379000000,9.95,0.225,0.095,129.29,4,4,11,0,0,10.96,9.39,1.212,1.896,1.393,-,0.936,124.37,76.95,117.14,107.76,289891000,2025-01-03,2024-12-02,109.05
HPQ,Common Stock,HP Inc,"HP Inc. is an American multinational information technology company headquartered in Palo Alto, California, that develops personal computers (PCs), printers and related supplies, as well as 3D printing solutions.",47217,NYSE,USD,USA,TECHNOLOGY,COMPUTER & OFFICE EQUIPMENT,"3000 HANOVER ST, MS 1050, PALO ALTO, CA, US",https://www.hp.com,October,2024-10-31,31735085000,5045000000,12.04,1.241,-1.444,0,0.0282,2.81,53.95,0.0533,0.0749,0.0705,0,53320999000,11508000000,2.81,-0.145,0.024,36.24,1,3,11,1,1,12.04,9.43,0.595,-,0.736,8.35,1.087,39.47,26.76,36.58,33.99,937798000,2025-01-02,2024-12-11,33.84
DD,Common Stock,Dupont De Nemours Inc,"DuPont de Nemours, Inc., commonly known as DuPont, is an American company formed by the merger of Dow Chemical and E. I. du Pont de Nemours and Company on August 31, 2017, and the subsequent spinoffs of Dow Inc. and Corteva. Prior to the spinoffs it was the world's largest chemical company in terms of sales.",1666700,NYSE,USD,USA,LIFE SCIENCES,"PLASTIC MATERIALS, SYNTH RESINS & NONVULCAN ELASTOMERS","974 CENTRE ROAD, BUILDING 730, WILMINGTON, DE, US",https://www.dupont.com,December,2024-09-30,33490733000,2978000000,62.6,0.443,57.94,1.5,0.019,1.28,28.88,0.0655,0.166,0.0292,0.0219,12192000000,4615000000,1.28,0.548,0.044,97.38,3,9,5,0,2,62.6,18.08,2.747,1.383,3.196,18.51,1.338,89.65,59.97,83.63,80.16,417955000,2024-12-16,2024-11-29,80.13
CCL,Common Stock,Carnival Corporation,"Carnival Corporation & plc is a British-American cruise operator, currently the world's largest travel leisure company, with a combined fleet of over 100 vessels across 10 cruise line brands.",815097,NYSE,USD,USA,ENERGY & TRANSPORTATION,WATER TRANSPORTATION,"3655 N W 87TH AVE, PO BOX 1347, MIAMI, FL, US",https://www.carnivalcorp.com,November,2024-08-31,34512380000,5878000000,21.98,1.41,6.79,None,None,1.17,19.35,0.0639,0.276,0.0425,0.201,24479001000,10702000000,1.17,0.599,0.152,27.97,5,17,5,2,0,21.98,15.13,1.41,4.014,2.584,10.72,2.668,27.16,13.78,23.44,18.07,1154160000,2020-03-13,2020-02-20,29.90
DB,Common Stock,Deutsche Bank AG,"Deutsche Bank Aktiengesellschaft offers investment, financial and related products and services to individuals, corporate entities and institutional clients worldwide. The company is headquartered in Frankfurt am Main, Germany.",1159508,NYSE,USD,USA,FINANCE,STATE COMMERCIAL BANKS,"DEUTSCHE BANK AG - LEGAL DEPARTMENT, 60 WALL STREET - 36TH FLOOR, ROOM 3609, NEW YORK, NY, US",https://www.db.com,December,2024-09-30,33137521000,None,8.34,7.75,38.54,0.45,0.0291,2.01,13.76,0.162,0.313,0.0034,0.0612,27631000000,25985000000,2.01,0.446,0.017,15.43,-,-,-,-,-,8.34,6.2,1.239,0.434,5.33,-,1.112,18.07,12.08,17.07,15.97,1943900000,2024-05-21,2024-05-17,17.05
ABEV,Common Stock,Ambev SA ADR,"Ambev SA produces, distributes and sells beer, draft beer, carbonated soft drinks (CSD), other non-alcoholic beverages, malt and food products in the Americas. The company is headquartered in So Paulo, Brazil.",1565025,NYSE,USD,USA,MANUFACTURING,BEVERAGES,"RUA DR. RENATO PAES DE BARROS, 1017, 3 ANDAR PARTE, SAO PAULO, BR",https://www.ambev.com.br,December,2024-09-30,34916602000,23570741000,14.8,1.989,6.24,0.73,0.068,0.15,5.24,0.169,0.239,0.0865,0.151,82406482000,39286758000,0.15,-0.114,0.088,3.08,1,4,5,0,1,14.8,13.3,0.405,2.09,2.238,6.99,0.552,2.85,2.01,2.317,2.328,15728200000,2024-01-05,2023-12-22,2.22
TPL,Common Stock,Texas Pacific Land Trust,"Texas Pacific Land Corporation is engaged in land and resource management, and water operations and services businesses. The company is headquartered in Dallas, Texas.",1811074,NYSE,USD,USA,REAL ESTATE & CONSTRUCTION,OIL ROYALTY TRADERS,"1700 PACIFIC AVENUE, SUITE 2900, DALLAS, TX, US",https://www.texaspacific.com,December,2024-09-30,27653970000,548542000,61.73,0,45.79,4.603,0.0053,19.5,29.86,0.653,0.734,0.294,0.445,686696000,649904000,19.5,0.011,0.099,565.13,-,-,-,-,-,61.73,37.74,40.27,26.28,39.22,49.14,1.589,1767.37,456.12,1266.19,848.73,22974900,2024-12-16,2024-12-02,1203.66
OWL,Common Stock,Blue Owl Capital Inc,"Blue Owl Capital Inc. is an asset manager. The company is headquartered in New York, New York.",1823945,NYSE,USD,USA,FINANCE,INVESTMENT ADVICE,"399 PARK AVENUE, 38TH FLOOR, NEW YORK, NY, US",https://www.blueowl.com,December,2024-09-30,36307472000,1005714000,135.06,None,3.526,0.68,0.0296,0.18,4.18,0.0495,0.336,0.0482,0.0769,2158101000,862458000,0.18,0.487,0.399,24.45,3,8,4,0,0,135.06,26.45,16.82,6.9,7.7,19.77,1.142,25.03,13.87,22.98,19.34,568431000,2024-11-22,2025-02-27,63.87
WAB,Common Stock,Westinghouse Air Brake Technologies Corp,"Wabtec Corporation (derived from Westinghouse Air Brake Technologies Corporation) is an American company formed by the merger of the Westinghouse Air Brake Company (WABCO) and MotivePower Industries Corporation in 1999. It is headquartered in Pittsburgh, Pennsylvania.",943452,NYSE,USD,USA,MANUFACTURING,RAILROAD EQUIPMENT,"30 ISABELLA STREET, PITTSBURGH, PA, US",https://www.wabteccorp.com,December,2024-09-30,34066881000,2110000000,32.98,3.92,59.11,0.77,0.004,6.01,58.76,0.102,0.165,0.0545,0.104,10330000000,2583000000,6.01,0.226,0.044,219.78,2,6,3,0,0,32.98,23.75,3.298,3.324,3.648,17.99,1.272,207.51,123.15,194.77,168.7,171890000,2024-11-27,2024-11-13,198.19
RBLX,Common Stock,Roblox Corp,"Roblox Corporation develops and operates an online entertainment platform. The company is headquartered in San Mateo, California.",1315098,NYSE,USD,USA,TECHNOLOGY,SERVICES-PREPACKAGED SOFTWARE,"970 PARK PLACE, SAN MATEO, CA, US",https://corp.roblox.com,December,2024-09-30,40193720000,-944729024,None,8.18,0.289,None,None,-1.63,5.26,-0.309,-0.303,-0.118,-7.01,3363735000,364458000,-1.63,0,0.288,56.02,8,14,8,2,0,-,192.31,11.95,211.65,11.78,-24.79,1.561,61.77,29.55,49.12,41.38,607547000,None,None,66.16
ED,Common Stock,Consolidated Edison Inc,"Consolidated Edison, Inc., commonly known as Con Edison (stylized as conEdison) or ConEd, is one of the largest investor-owned energy companies in the United States, with approximately $12 billion in annual revenues as of 2017, and over $48 billion in assets. The company provides a wide range of energy-related products and services to its customers through its subsidiaries.",1047862,NYSE,USD,USA,ENERGY & TRANSPORTATION,ELECTRIC & OTHER SERVICES COMBINED,"4 IRVING PLACE, NEW YORK, NY, US",https://www.conedison.com,December,2024-09-30,31472243000,5556000000,17.08,8.67,63.29,3.3,0.0365,5.32,43.46,0.123,0.212,0.0322,0.0858,15031000000,7685000000,5.32,0.112,0.057,100.47,0,3,11,1,4,17.08,16.21,2.094,1.437,3.837,10.49,0.353,106.83,83.7,99.81,96.38,346458000,2024-12-16,2024-11-13,90.84
RJF,Common Stock,Raymond James Financial Inc.,"Raymond James Financial is an American multinational independent investment bank and financial services company providing financial services to individuals, corporations, and municipalities through its subsidiary companies that engage primarily in investment and financial planning, in addition to investment banking and asset management.",720005,NYSE,USD,USA,FINANCE,"SECURITY BROKERS, DEALERS & FLOTATION COMPANIES","880 CARILLON PKWY, ST PETERSBURG, FL, US",https://www.raymondjames.com,September,2024-09-30,32218704000,None,16.28,1.932,54.08,1.8,0.0125,9.7,61.69,0.162,0.225,0.024,0.194,12775999000,10760000000,9.7,0.417,0.132,153.21,3,4,8,0,1,16.28,15.02,2.522,2.779,2.8,-,1.002,171.38,103.85,152.25,128.45,204045000,2025-01-16,2025-01-02,157.90
VICI,Common Stock,VICI Properties Inc,"VICI Properties is an experiential real estate investment trust that owns one of the largest portfolios of market-leading gaming, hospitality and entertainment destinations, including the world-renowned Caesars Palace. ",1705696,NYSE,USD,USA,REAL ESTATE & CONSTRUCTION,REAL ESTATE INVESTMENT TRUSTS,"430 PARK AVENUE,  8TH FLOOR, NEW YORK, NY, US",https://www.viciproperties.com,December,2024-09-30,31677807000,3661391000,11.13,None,24.93,1.678,0.0559,2.7,3.651,0.739,0.986,0.0521,0.112,3805018000,2615211000,2.7,0.275,0.067,35.77,6,14,3,0,0,11.13,11.76,8.33,1.249,13.11,13.55,0.961,33.38,25.97,32.03,30.6,1054170000,2025-01-09,2024-12-17,30.05
ROK,Common Stock,Rockwell Automation Inc,"Rockwell Automation, Inc. is an American provider of industrial automation and information technology. Its brands include Allen-Bradley and Factory Talk software.",1024478,NYSE,USD,USA,LIFE SCIENCES,"MEASURING & CONTROLLING DEVICES, NEC","1201 SOUTH 2ND STREET, MILWAUKEE, WI, US",https://www.rockwellautomation.com,September,2024-09-30,33134139000,1613700000,35.45,5.81,30.93,5,0.0179,8.28,72.49,0.115,0.155,0.0725,0.255,8264200000,3717000000,8.28,-0.198,-0.206,296.27,3,6,15,1,3,35.45,31.15,4.009,9.47,4.447,23.39,1.359,307.01,240.53,280.85,272.65,112897000,2024-12-10,2024-11-18,293.49
HOOD,Common Stock,Robinhood Markets Inc,None,1783879,NASDAQ,USD,USA,FINANCE,"SECURITY BROKERS, DEALERS & FLOTATION COMPANIES","85 WILLOW STREET, MENLO PARK, CA, US",https://robinhood.com,December,2024-09-30,36799922000,138119000,71.78,None,8.16,None,None,0.58,2.747,0.218,0.258,0.0151,0.0762,2408000000,906000000,0.58,6.6,0.364,44.24,4,6,6,0,1,71.78,-,15.28,5.11,13.73,55.01,1.839,43.83,10.38,31.81,23.01,763563000,None,None,48.20
EIX,Common Stock,Edison International,"Edison International is a public utility holding company based in Rosemead, California. Its subsidiaries include Southern California Edison, and unregulated non-utility business assets Edison Energy.",827052,NYSE,USD,USA,ENERGY & TRANSPORTATION,ELECTRIC SERVICES,"2244 WALNUT GROVE AVE,, P O BOX 800, ROSEMEAD, CA, US",https://www.edison.com,December,2024-09-30,31165577000,6444000000,23.54,1.325,36.21,3.12,0.0408,3.42,44.96,0.0763,0.212,0.0298,0.0741,17321001000,9414000000,3.42,2.3,0.106,90.11,2,11,6,2,0,23.54,14.24,1.799,2.242,4.011,10.96,0.935,88.64,61.2,84.13,78.16,387150000,2025-01-31,2025-01-07,80.50
TTWO,Common Stock,Take-Two Interactive Software Inc,"Take-Two Interactive Software, Inc. is an American video game holding company based in New York City. The company owns two major publishing labels, Rockstar Games and 2K, which operate internal game development studios.",946581,NASDAQ,USD,USA,TECHNOLOGY,SERVICES-PREPACKAGED SOFTWARE,"110 WEST 44TH STREET, NEW YORK, NY, US",https://www.take2games.com,March,2024-09-30,32654328000,165600000,None,2.426,33.04,None,None,-21.2,31.69,-0.664,-0.198,-0.0228,-0.509,5457000000,2040010000,-21.2,-0.497,0.041,193.84,6,15,5,0,0,-,24.27,5.98,5.63,6.58,49.45,0.85,191.91,135.24,173.13,156.51,175627000,None,None,185.93
ETR,Common Stock,Entergy Corporation,Entergy Corporation is a Fortune 500 integrated energy company engaged primarily in electric power production and retail distribution operations in the Deep South of the United States.,65984,NYSE,USD,USA,ENERGY & TRANSPORTATION,ELECTRIC SERVICES,"639 LOYOLA AVE, NEW ORLEANS, LA, US",https://www.entergy.com,December,2024-09-30,32092588000,4596974000,18.16,8.91,70.11,4.52,0.0321,4.12,55.64,0.148,0.337,0.0241,0.119,11862153000,5278351000,4.12,-0.048,-0.057,80.19,4,8,7,0,1,18.16,19.3,2.705,2.135,5.03,13.08,0.701,79.03,45.25,72.05,60.07,428816000,2024-12-02,2024-11-13,74.84
AVB,Common Stock,AvalonBay Communities Inc,"AvalonBay Communities, Inc. is a publicly traded real estate investment trust that invests in apartments.",915912,NYSE,USD,USA,REAL ESTATE & CONSTRUCTION,REAL ESTATE INVESTMENT TRUSTS,"4040 WILSON BOULEVARD, STE 1000, ARLINGTON, VA, US",https://www.avalonbay.com,December,2024-09-30,32279263000,1808051000,30.96,6.54,83.67,6.75,0.0299,7.33,20.61,0.356,0.337,0.0287,0.0881,2926011000,1689582000,7.33,1.161,0.094,240,5,4,14,0,0,30.96,41.84,11.03,2.716,14.0,19.14,0.985,239.29,165.14,226.94,208.66,142237000,2025-01-15,2024-12-31,226.94
CSGP,Common Stock,CoStar Group Inc,"CoStar Group, Inc. provides online market information, analysis and services to the commercial real estate, hospitality, residential and related professional industries in the United States, Canada, Europe, Asia Pacific and Latin America. The company is headquartered in Washington, the District of Columbia.",1057352,NASDAQ,USD,USA,TRADE & SERVICES,"SERVICES-BUSINESS SERVICES, NEC","1331 L STREET, NW, WASHINGTON, DC, US",https://www.costargroup.com,December,2024-09-30,29980373000,170300000,174.12,2.615,18.29,None,None,0.42,6.57,0.0658,0.0342,0.0024,0.0239,2666900000,1768391000,0.42,-0.409,0.109,90.38,5,5,4,0,0,174.12,67.57,11.24,4.117,10.13,158.6,0.823,100.38,68.26,76.32,80.25,409960000,None,None,73.13
ALNY,Common Stock,Alnylam Pharmaceuticals Inc,"Alnylam Pharmaceuticals, Inc., a biopharmaceutical company, focuses on discovering, developing and commercializing RNA interference (RNAi) therapies. The company is headquartered in Cambridge, Massachusetts.",1178670,NASDAQ,USD,USA,LIFE SCIENCES,PHARMACEUTICAL PREPARATIONS,"675 WEST KENDALL STREET, HENRI A. TERMEER SQUARE, CAMBRIDGE, MA, US",https://www.alnylam.com,December,2024-09-30,31804135000,-132146000,None,-0.49,0.251,None,None,-2.61,16.52,-0.159,-0.153,-0.0292,-15.01,2094795000,868601000,-2.61,0,-0.333,299.11,11,11,8,1,1,-,909.09,15.18,983.0,14.48,204.85,0.386,304.39,141.98,266.81,219.35,128981000,None,None,246.58
WTW,Common Stock,Willis Towers Watson PLC,None,1140536,NASDAQ,USD,USA,FINANCE,"INSURANCE AGENTS, BROKERS & SERVICE","C/O WILLIS GROUP LIMITED, 51 LIME STREET, LONDON ENGLAND, GB",https://www.wtwco.com,December,2024-09-30,31278133000,2581000000,None,1.08,74.27,0.88,0.0113,-7.24,95.47,-0.0736,0.166,0.0484,-0.0836,9809000000,4073000000,-7.24,0.548,0.057,353.39,6,4,8,0,2,-,16.61,3.189,4.175,3.659,16.66,0.742,334.99,231.83,306.32,279.33,100725000,2025-01-15,2024-12-31,310.53
EFX,Common Stock,Equifax Inc,"Equifax Inc. is an American multinational consumer credit reporting agency and is one of the three largest consumer credit reporting agencies, along with Experian and TransUnion. In addition to credit and demographic data and services to business, Equifax sells credit monitoring and fraud prevention services directly to consumers.",33185,NYSE,USD,USA,TRADE & SERVICES,"SERVICES-CONSUMER CREDIT REPORTING, COLLECTION AGENCIES","1550 PEACHTREE ST NW, ATLANTA, GA, US",https://www.equifax.com,December,2024-09-30,33921946000,1697700000,60.95,0.832,39.62,1.56,0.0057,4.49,45.19,0.101,0.171,0.0522,0.119,5588200000,2945000000,4.49,-0.137,0.093,313.32,4,12,6,0,0,60.95,28.65,6.07,6.91,6.97,23.35,1.594,309.15,212.08,268.03,263.21,123952000,2024-12-13,2024-11-22,273.67
UAL,Common Stock,United Airlines Holdings Inc,"United Airlines Holdings, Inc. (formerly known as United Continental Holdings, Inc., UAL Corporation, Allegis Corporation and founded originally as UAL, Inc.) is a publicly traded airline holding company headquartered in the Willis Tower in Chicago. UAH owns and operates United Airlines, Inc.",100517,NASDAQ,USD,USA,ENERGY & TRANSPORTATION,"AIR TRANSPORTATION, SCHEDULED","ROBERT S. RIVKIN - WHQLD, 233 SOUTH WACKER DRIVE, CHICAGO, IL, US",https://www.united.com,December,2024-09-30,31239930000,7483000000,11.32,0.772,34.78,None,None,8.39,170.47,0.0494,0.107,0.0411,0.273,55993999000,13186000000,8.39,-0.152,0.025,107.92,7,16,0,1,0,11.32,7.56,0.558,2.732,0.851,9.26,1.393,105.09,37.02,84.16,57.07,328876000,2008-01-23,2008-01-07,94.99
LYV,Common Stock,Live Nation Entertainment Inc,"Live Nation Entertainment, Inc is an American global entertainment company, founded in 2010, following the merger of Live Nation and Ticketmaster. The company promotes, operates, and manages ticket sales for live entertainment in the United States and internationally. It also owns and operates entertainment venues, and manages the careers of music artists.",1335258,NYSE,USD,USA,TRADE & SERVICES,SERVICES-AMUSEMENT & RECREATION SERVICES,"9348 CIVIC CENTER DRIVE, BEVERLY HILLS, CA, US",https://www.livenationentertainment.com,December,2024-09-30,31790379000,1534735000,153.18,4.957,1.256,None,None,0.9,101.5,0.0201,0.0831,0.0319,0.358,23315468000,4343730000,0.9,-0.139,-0.062,143.58,5,14,1,1,1,153.18,72.46,1.363,110.4,1.479,19.57,1.334,141.18,86.67,125.76,104.17,230599000,None,None,137.86
BRO,Common Stock,Brown & Brown Inc,"Brown & Brown, Inc. markets and sells insurance products and services in the United States, Bermuda, Canada, the Cayman Islands, Ireland, and the United Kingdom. The company is headquartered in Daytona Beach, Florida.",79282,NYSE,USD,USA,FINANCE,"INSURANCE AGENTS, BROKERS & SERVICE","220 S. RIDGEWOOD AVE., DAYTONA BEACH, FL, US",https://www.bbinsurance.com,December,2024-09-30,29505149000,1528300000,28.11,4.41,22.6,0.52,0.0057,3.67,16.26,0.231,0.283,0.052,0.181,4558700000,1750000000,3.67,0.311,0.099,114.28,4,2,6,0,1,28.11,25.32,6.47,4.564,7.04,17.93,0.825,114.15,68.78,107.74,96.34,285958000,2024-11-13,2024-11-06,103.18
FITB,Common Stock,Fifth Third Bancorp,"Fifth Third Bank is a bank headquartered in Cincinnati, Ohio, at Fifth Third Center. It is the principal subsidiary of Fifth Third Bancorp, a diversified bank holding company.",35527,NASDAQ,USD,USA,FINANCE,STATE COMMERCIAL BANKS,"38 FOUNTAIN SQ PLZ, FIFTH THIRD CENTER, CINCINNATI, OH, US",https://www.53.com,December,2024-09-30,30207961000,None,15.02,3.675,27.6,1.42,0.0324,3,11.78,0.276,0.369,0.0104,0.119,8063000000,7823000000,3,-0.143,-0.03,50.02,5,6,10,0,1,15.02,12.5,3.747,1.638,6.22,-,1.231,49.07,31.39,45.48,40.18,670543000,2025-01-15,2024-12-31,45.05
ZS,Common Stock,Zscaler Inc,"Zscaler, Inc. is a global cloud security company. The company is headquartered in San Jose, California.",1713683,NASDAQ,USD,USA,TECHNOLOGY,SERVICES-COMPUTER PROGRAMMING SERVICES,"110 ROSE ORCHARD WAY, SAN JOSE, CA, US",https://www.zscaler.com,July,2024-10-31,30756850000,-90237000,None,3.611,8.36,None,None,-0.25,14.49,-0.0266,-0.0455,-0.0183,-0.0577,2167771000,1255249000,-0.25,0,0.303,226.15,8,21,15,0,0,-,72.46,14.19,21.96,13.0,319.53,0.814,259.61,153.45,196.85,186.0,153439000,None,None,200.45
TW,Common Stock,Tradeweb Markets Inc,"Tradeweb Markets Inc. creates and operates electronic marketplaces in the Americas, Europe, the Middle East, Africa, Asia Pacific and internationally. ",1758730,NASDAQ,USD,USA,FINANCE,"SECURITY & COMMODITY BROKERS, DEALERS, EXCHANGES & SERVICES","1177 AVENUE OF THE AMERICAS, NEW YORK, NY, US",https://www.tradeweb.com,December,2024-09-30,29088676000,None,64.08,3.059,26.74,0.39,0.003,2.08,7.66,0.275,0.39,0.0742,0.0849,1630279000,1122924000,2.08,0.152,0.365,145.93,5,6,4,0,1,64.08,42.19,17.84,4.984,16.7,32.45,1.009,141.69,88.19,132.07,115.03,116229000,2024-12-16,2024-12-02,250.27
CUK,Common Stock,Carnival Plc ADS,"Carnival Corporation & plc is a leisure travel company. The company is headquartered in Miami, Florida.",1125259,NYSE,USD,USA,ENERGY & TRANSPORTATION,WATER TRANSPORTATION,"100 HARBOUR PARADE, CARNIVAL HOUSE, SOUTHAMPTON SO15 1ST, GB",https://www.carnivalcorp.com,November,2024-08-31,29749508000,5878000000,19.99,0.0353,6.79,None,None,1.17,19.35,0.0639,0.276,0.0425,0.201,24479001000,10702000000,1.17,0.599,0.152,28,-,-,-,-,-,19.99,14.01,1.215,3.447,2.396,9.94,2.668,24.66,12.5,21.29,16.42,144807000,2020-03-13,2020-02-20,205.44
WEC,Common Stock,WEC Energy Group Inc,"WEC Energy Group, based in Milwaukee, Wisconsin, provides electricity and natural gas to 4.4 million customers across four states.",783325,NYSE,USD,USA,ENERGY & TRANSPORTATION,ELECTRIC & OTHER SERVICES COMBINED,"231 W MICHIGAN ST, P O BOX 1331, MILWAUKEE, WI, US",https://www.wecenergygroup.com,December,2024-09-30,29961886000,3489200000,23.16,2.472,38.19,3.285,0.0376,4.09,27.02,0.151,0.213,0.0304,0.105,8533200000,3307500000,4.09,-0.241,-0.048,100.72,1,3,11,0,3,23.16,18.05,3.511,2.48,5.74,13.61,0.438,102.79,73.07,97.54,87.92,316354000,2025-03-01,2025-02-14,94.71
