Symbol,AssetType,Name,Description,CIK,Exchange,Currency,Country,Sector,Industry,Address,OfficialSite,FiscalYearEnd,LatestQuarter,MarketCapitalization,EBITDA,PERatio,PEGRatio,BookValue,DividendPerShare,DividendYield,EPS,RevenuePerShareTTM,ProfitMargin,OperatingMarginTTM,ReturnOnAssetsTTM,ReturnOnEquityTTM,RevenueTTM,GrossProfitTTM,DilutedEPSTTM,QuarterlyEarningsGrowthYOY,QuarterlyRevenueGrowthYOY,AnalystTargetPrice,AnalystRatingStrongBuy,AnalystRatingBuy,AnalystRatingHold,AnalystRatingSell,AnalystRatingStrongSell,TrailingPE,ForwardPE,PriceToSalesRatioTTM,PriceToBookRatio,EVToRevenue,EVToEBITDA,Beta,52WeekHigh,52WeekLow,50DayMovingAverage,200DayMovingAverage,SharesOutstanding,DividendDate,ExDividendDate,PricePerShare
NOC,Common Stock,Northrop Grumman Corporation,Northrop Grumman Corporation (NYSE: NOC) is an American multinational aerospace and defense technology company.,1133421,NYSE,USD,USA,MANUFACTURING,"SEARCH, DETECTION, NAVAGATION, GUIDANCE, AERONAUTICAL SYS","2980 FAIRVIEW PARK DRIVE, C/O NORTHROP GRUMMAN CORP, FALLS CHURCH, VA, US",https://www.northropgrumman.com,December,2024-09-30,69975859000,4458000000,29.59,0.837,101.14,7.86,0.0172,16.23,276.41,0.058,0.129,0.0416,0.155,40985002000,7474000000,16.23,0.133,0.023,561.45,2,7,13,1,1,29.59,17.24,1.707,4.745,2.029,17.87,0.346,553.23,415.2,506.64,482.12,145695000,2024-12-18,2024-12-02,480.29
ECL,Common Stock,Ecolab Inc,"Ecolab Inc., headquartered in St. Paul, Minnesota, is an American corporation that develops and offers services, technology and systems that specialize in water treatment, purification, cleaning and hygiene in a wide variety of applications. It helps organizations both private market as well as public treat their water, not only for drinking directly, but also for use in food, healthcare, hospitality related safety and industry.",31462,NYSE,USD,USA,LIFE SCIENCES,"SOAP, DETERGENTS, CLEANG PREPARATIONS, PERFUMES, COSMETICS","1 ECOLAB PLACE, SAINT PAUL, MN, US",https://www.ecolab.com,December,2024-09-30,69705982000,3538600000,34.48,2.476,23.46,2.28,0.0106,7.14,55.04,0.131,0.147,0.0742,0.252,15674600000,5426700000,7.14,0.065,0.178,275.24,4,8,14,0,1,34.48,32.79,4.447,8.15,4.896,19.88,1.141,261.92,191.59,250.36,240.24,283162000,2025-01-15,2024-12-17,246.17
CSX,Common Stock,CSX Corporation,"CSX Corporation is an American holding company focused on rail transportation and real estate in North America, among other industries. Based in Richmond, Virginia, USA after the merger, in 2003 the CSX Corporation headquarters moved to Jacksonville, Florida.",277948,NASDAQ,USD,USA,ENERGY & TRANSPORTATION,"RAILROADS, LINE-HAUL OPERATING","500 WATER STREET, 15TH FLOOR, JACKSONVILLE, FL, US",https://www.csx.com,December,2024-09-30,63502868000,7191000000,17.52,2.077,6.71,0.47,0.0146,1.88,7.53,0.25,0.377,0.0816,0.295,14681000000,7390000000,1.88,0.122,0.013,38.74,5,13,10,0,0,17.52,16.42,4.325,4.912,5.51,11.08,1.191,39.58,31.52,34.7,34.48,1928420000,2024-12-13,2024-11-29,32.93
CNI,Common Stock,Canadian National Railway Co,"Canadian National Railway Company, is engaged in the rail and related transportation business. The company is headquartered in Montreal, Canada.",16868,NYSE,USD,USA,ENERGY & TRANSPORTATION,"RAILROADS, LINE-HAUL OPERATING","935 DE LA GAUCHETIERE ST W, MONTREAL QUEBEC, CANADA, QC, CA",https://www.cn.ca,December,2024-09-30,64861172000,8841000000,17.33,3.376,30.95,3.325,0.0232,5.94,26.9,0.317,0.396,0.0818,0.276,17159000000,9623000000,5.94,0.018,0.031,122.33,7,5,20,0,1,17.33,17.76,3.78,4.736,6.61,12.68,0.648,131.9,101.4,110.43,118.98,628800000,2024-12-30,2024-12-09,103.15
BNS,Common Stock,Bank of Nova Scotia,"The Bank of Nova Scotia offers various banking products and services in Canada, the United States, Mexico, Peru, Chile, Colombia, the Caribbean and Central America, and internationally. The company is headquartered in Halifax, Canada.",9631,NYSE,USD,USA,FINANCE,STATE COMMERCIAL BANKS,"44 KING STREET WEST, SCOTIA PLAZA 8TH FL., TORONTO, ON, CA",https://www.scotiabank.com,October,2024-10-31,68508205000,None,13.29,1.508,65.87,0,0.0538,4.12,24.3,0.254,0.323,0.0055,0.0949,29599001000,29252000000,4.12,-0.173,0.009,55.24,1,5,8,0,0,13.29,11.03,2.314,1.318,12.11,-,0.978,57.07,43.02,54.09,49.8,1244440000,2025-01-29,2024-10-02,55.05
CRH,Common Stock,CRH PLC ADR,"CRH plc manufactures and distributes construction materials. The company is headquartered in Dublin, Ireland.",849395,NYSE,USD,USA,MANUFACTURING,"CEMENT, HYDRAULIC","STONEMASON’S WAY, RATHFARNHAM, DUBLIN, IE",https://www.crh.com,December,2024-06-30,65926316000,6527000000,19.48,1.933,32.18,2.13,0.0144,4.99,51.38,0.0986,0.181,0.062,0.155,35386999000,10879000000,4.99,0.094,0.038,113.63,5,13,3,0,1,19.48,16.05,1.863,3.014,2.212,11.58,1.377,104.23,64.92,97.22,86.12,678045000,2024-12-18,2024-11-22,97.23
BMO,Common Stock,Bank of Montreal,"Bank of Montreal offers diversified financial services primarily in North America. The company is headquartered in Montreal, Canada.",927971,NYSE,USD,USA,FINANCE,"COMMERCIAL BANKS, NEC","1 FIRST CANADIAN PLACE, TORONTO, ON, CA",https://www.bmo.com,October,2024-10-31,71819002000,None,14.67,0.707,105.41,0,0.0462,6.69,43.32,0.212,0.374,0.005,0.0849,31413000000,29021000000,6.69,0.17,-0.036,101.37,4,1,8,0,0,14.67,12.74,2.286,1.246,11.46,-,1.16,104.63,76.06,94.3,90.29,729865000,2025-02-26,2024-10-30,98.40
TEAM,Common Stock,Atlassian Corp Plc,"Atlassian Corporation Plc designs, develops, licenses and maintains various software products worldwide. The company is headquartered in Sydney, Australia.",1650372,NASDAQ,USD,USA,TECHNOLOGY,SERVICES-PREPACKAGED SOFTWARE,"350 BUSH STREET, FLOOR 13, SAN FRANCISCO, CA, US",https://www.atlassian.com,June,2024-09-30,70262219000,-43705000,None,4.051,3.946,None,None,-1.51,17.59,-0.0859,-0.0269,-0.0179,-0.435,4568609000,2910074000,-1.51,1.722,0.215,270.49,6,14,9,0,0,-,81.3,15.38,68.29,15.17,4851.24,0.711,287.97,135.29,229.4,188.56,161456000,None,None,435.18
WMB,Common Stock,Williams Companies Inc,"The Williams Companies, Inc., is an American energy company based in Tulsa, Oklahoma. Its core business is natural gas processing and transportation, with additional petroleum and electricity generation assets.",107263,NYSE,USD,USA,ENERGY & TRANSPORTATION,NATURAL GAS TRANSMISSION,"ONE WILLIAMS CTR, TULSA, OK, US",https://www.williams.com,December,2024-09-30,65448649000,5864000000,22.75,8.92,10.17,1.873,0.0352,2.36,8.51,0.278,0.328,0.044,0.206,10366000000,6078000000,2.36,0.077,0.045,55.48,4,7,8,2,0,22.75,25,6.31,5.28,8.71,12.32,1.062,59.84,31.25,54.41,44.81,1219010000,2024-12-30,2024-12-13,53.69
CARR,Common Stock,Carrier Global Corp,"Carrier Global Corporation is an American multinational home appliances corporation based in Palm Beach Gardens, Florida.",1783180,NYSE,USD,USA,TECHNOLOGY,AIR-COND & WARM AIR HEATG EQUIP & COMM & INDL REFRIG EQUIP,"13995 PASTEUR BOULEVARD, PALM BEACH GARDENS, FL, US",https://www.corporate.carrier.com,December,2024-09-30,64232473000,3318000000,42.08,1.705,16.37,0.76,0.0126,1.67,28.01,0.14,0.127,0.0418,0.139,24800999000,5473000000,1.67,0.167,0.213,82.57,2,9,13,1,0,42.08,23.7,2.59,4.372,3.019,19.34,1.212,83.1,52.67,76.42,67.83,897227000,2025-02-07,2024-12-20,71.59
AJG,Common Stock,Arthur J Gallagher & Co,"Arthur J. Gallagher & Co. (AJG) is an American global insurance brokerage and risk management services firm headquartered in Rolling Meadows, Illinois.",354190,NYSE,USD,USA,FINANCE,"INSURANCE AGENTS, BROKERS & SERVICE","2850 GOLF ROAD, ROLLING MEADOWS, IL, US",https://www.ajg.com,December,2024-09-30,70671770000,3382200000,54.09,1.011,55.53,2.35,0.0084,5.23,48.96,0.11,0.187,0.0292,0.103,10667700000,3643900000,5.23,0.086,0.119,295.67,3,5,8,0,3,54.09,25.19,6.62,5.86,6.92,30.29,0.727,316.09,216.7,292.74,271.11,249803000,2024-12-20,2024-12-06,282.91
RSG,Common Stock,Republic Services Inc,"Republic Services, Inc is the second largest provider of non-hazardous solid waste collection, transfer, disposal, recycling, and energy services in the United States, as measured by revenue.",1060391,NYSE,USD,USA,ENERGY & TRANSPORTATION,REFUSE SYSTEMS,"18500 N. ALLIED WAY, PHOENIX, AZ, US",https://www.republicservices.com,December,2024-09-30,64390312000,4804800000,32.9,3.348,35.84,2.185,0.0111,6.25,50.24,0.125,0.21,0.0633,0.183,15817600000,5459100000,6.25,0.185,0.065,221.77,3,8,11,1,0,32.9,29.76,4.071,5.73,4.875,16.55,0.707,220.58,159.31,208.32,197.7,313152000,2025-01-15,2025-01-02,205.62
TTD,Common Stock,Trade Desk Inc,"Trade Desk, Inc. is a technology company in the United States and internationally. The company is headquartered in Ventura, California.",1671933,NASDAQ,USD,USA,TECHNOLOGY,"SERVICES-COMPUTER PROGRAMMING, DATA PROCESSING, ETC.","42 N. CHESTNUT STREET, VENTURA, CA, US",https://www.thetradedesk.com,December,2024-09-30,66642366000,446203000,217.77,2.655,5.32,None,None,0.62,4.716,0.133,0.173,0.0469,0.129,2309616000,1296672000,0.62,1.375,0.273,129.59,5,23,6,3,0,217.77,101.01,28.85,25.38,28.23,141.68,1.47,141.53,61.48,124.68,101.57,449655000,None,None,148.21
WDAY,Common Stock,Workday Inc,"Workday, Inc. provides business applications in the cloud worldwide. The company is headquartered in Pleasanton, California.",1327811,NASDAQ,USD,USA,TECHNOLOGY,SERVICES-COMPUTER PROCESSING & DATA PREPARATION,"6230 STONERIDGE MALL ROAD, SUITE 200, PLEASANTON, CA, US",https://www.workday.com,January,2024-10-31,73950659000,636000000,45.58,2.349,30.63,None,None,6.1,29.81,0.196,0.0532,0.0143,0.211,7863000000,4500640000,6.1,0.661,0.167,291.74,11,16,11,1,0,45.58,32.79,9.4,8.59,8.61,65.22,1.352,311.28,199.81,254.24,245.58,214000000,None,None,345.56
DEO,Common Stock,Diageo PLC ADR,"Diageo plc produces, markets and sells alcoholic beverages. The company is headquartered in London, the United Kingdom.",835403,NYSE,USD,USA,MANUFACTURING,BEVERAGES,"LAKESIDE DRIVE, PARK ROYAL, LONDON, GB",https://www.diageo.com,June,2024-06-30,72947089000,6497000000,18.58,2.029,4.518,1.035,0.0322,6.92,2.014,0.191,0.273,0.083,0.35,20269001000,10214000000,6.92,-0.031,-0.014,134.43,1,2,3,1,1,18.58,14.9,3.599,7.12,4.639,13.27,0.391,150.19,117.23,126.43,133.42,555534000,2024-10-17,2024-08-30,131.31
ET,Common Stock,Energy Transfer LP,"Energy Transfer LP offers energy related services. The company is headquartered in Dallas, Texas.",1276187,NYSE,USD,USA,ENERGY & TRANSPORTATION,NATURAL GAS TRANSMISSION,"8111 WESTCHESTER DRIVE, SUITE 600, DALLAS, TX, US",https://energytransfer.com,December,2024-09-30,63821869000,14023000000,13.71,0.661,9.16,1.275,0.069,1.36,24.91,0.0605,0.105,0.0489,0.152,83661996000,13418000000,1.36,1.18,0.002,20.79,6,10,1,0,0,13.71,10.25,0.763,1.811,1.477,8.19,1.643,20.02,12.55,17.57,16.27,3423920000,2024-11-19,2024-11-08,18.64
RCL,Common Stock,Royal Caribbean Cruises Ltd,"Royal Caribbean Group, formerly known as Royal Caribbean Cruises Ltd., is an American global cruise holding company incorporated in Liberia and based in Miami, Florida, US.",884887,NYSE,USD,USA,ENERGY & TRANSPORTATION,WATER TRANSPORTATION,"1050 CARIBBEAN WAY, MIAMI, FL, US",https://www.rclinvestor.com,December,2024-09-30,65086575000,5642000000,24.23,0.655,26.2,0.4,0.0091,9.99,62.17,0.162,0.335,0.0731,0.443,16055000000,2375604000,9.99,0.154,0.175,245.25,4,14,5,0,1,24.23,16.98,4.054,9.27,5.39,14.79,2.6,258.7,112.84,222.38,168.72,268875000,2025-01-13,2024-12-27,242.07
MFG,Common Stock,Mizuho Financial Group Inc.,"Mizuho Financial Group, Inc. engages in banking, trusts, securities and other businesses related to financial services in Japan, America, Europe, Asia / Oceania and internationally. The company is headquartered in Tokyo, Japan.",1335730,NYSE,USD,USA,FINANCE,NATIONAL COMMERCIAL BANKS,"1-5-5, OTEMACHI, CHIYODA-KU, TOKYO, JP",https://www.mizuho-fg.co.jp,March,2024-09-30,62347244000,None,11.74,1.062,4037.28,0,0.029,0.42,260.45,0.219,0.382,0.0026,0.0729,3300875043000,2682428000000,0.42,0.18,0.232,5.2,0,1,1,0,0,11.74,9.88,0.0189,0.899,2.162,-,0.385,5.31,3.223,4.603,4.199,12646500000,2024-12-16,2024-03-27,4.93
SE,Common Stock,Sea Ltd,"Sea Limited is engaged in the digital entertainment, e-commerce and digital financial services businesses in Southeast Asia, Latin America, the rest of Asia and internationally. The company is headquartered in Singapore.",1703399,NYSE,USD,USA,TRADE & SERVICES,SERVICES-MISCELLANEOUS BUSINESS SERVICES,"C/O 1 FUSIONOPOLIS PLACE, # 17-10, GALAXIS, SINGAPORE, SG",https://www.sea.com,December,2024-09-30,66502824000,750103000,771.93,0.617,13.42,None,None,0.15,27.06,0.0063,0.0468,0.0094,0.0135,15486058000,5185277000,0.15,-0.741,0.308,121.24,7,22,2,1,1,771.93,46.08,4.294,8.31,4.024,135.72,1.525,119.47,34.35,104.81,78.48,528812000,2017-03-01,None,125.76
OKE,Common Stock,ONEOK Inc,"Oneok, Inc. is a diversified Fortune 500 energy corporation based in Tulsa, Oklahoma.",1039684,NYSE,USD,USA,ENERGY & TRANSPORTATION,NATURAL GAS TRANSMISISON & DISTRIBUTION,"100 WEST 5TH ST, TULSA, OK, US",https://www.oneok.com/,December,2024-09-30,59465069000,5612000000,21.56,2.642,28.91,3.96,0.0389,4.72,34.12,0.141,0.227,0.06,0.169,19933000000,4477026000,4.72,0.192,0.199,110.65,4,5,7,0,1,21.56,17.7,2.983,3.521,4.366,14.58,1.625,118.07,64.78,103.35,88.14,584251000,2024-11-14,2024-11-01,101.78
BDX,Common Stock,Becton Dickinson and Company,"Becton, Dickinson and Company, also known as BD, is an American multinational medical technology company that manufactures and sells medical devices, instrument systems, and reagents. BD also provides consulting and analytics services in certain geographies.",10795,NYSE,USD,USA,LIFE SCIENCES,SURGICAL & MEDICAL INSTRUMENTS & APPARATUS,"ONE BECTON DR, FRANKLIN LAKES, NJ, US",https://www.bd.com,September,2024-09-30,65237484000,5109000000,38.44,1.033,89.47,0,0.0175,5.87,68.37,0.0713,0.152,0.0325,0.0563,19828001000,8823000000,5.87,2.901,0.069,280.03,6,9,3,0,0,38.44,16.1,3.29,2.52,4.123,17.26,0.45,245.72,216.83,231.12,234.54,289122000,2024-12-31,2024-12-09,225.64
ADSK,Common Stock,Autodesk Inc,"Autodesk, Inc. is an American multinational software corporation that makes software products and services for the architecture, engineering, construction, manufacturing, media, education, and entertainment industries. Autodesk is headquartered in San Rafael, California.",769397,NASDAQ,USD,USA,TECHNOLOGY,SERVICES-PREPACKAGED SOFTWARE,"111 MCINNIS PKWY, SAN RAFAEL, CA, US",https://www.autodesk.com,January,2024-10-31,65260433000,1396000000,60.2,1.839,8.67,None,None,5.03,27.06,0.182,0.236,0.0889,0.575,5805000000,4583000000,5.03,0.262,0.119,327.01,5,12,12,0,0,60.2,33.11,11.24,24.95,11.09,44.86,1.474,326.62,195.32,297.05,255.48,215509000,None,2005-03-22,302.82
DLR,Common Stock,Digital Realty Trust Inc,"Digital Realty Trust, Inc. is a real estate investment trust that invests in carrier-neutral data centers and provides colocation and peering services.",1297996,NYSE,USD,USA,REAL ESTATE & CONSTRUCTION,REAL ESTATE INVESTMENT TRUSTS,"FOUR EMBARCADERO CENTER, SUITE 3200, SAN FRANCISCO, CA, US",https://www.digitalrealty.com,December,2024-09-30,62550163000,2337597000,151.64,10.67,61.91,4.88,0.0264,1.22,16.98,0.0821,0.101,0.0087,0.0196,5374854000,2660775000,1.22,-0.96,0.016,180.96,6,9,9,0,2,151.64,153.85,11.64,2.991,14.26,29.07,0.609,196.71,126.05,178.66,155.85,331713000,2025-01-17,2024-12-13,188.57
FCX,Common Stock,Freeport-McMoran Copper & Gold Inc,"Freeport-McMoRan Inc., often called Freeport, is an American mining company based in the Freeport-McMoRan Center, in Phoenix, Arizona.",831259,NYSE,USD,USA,ENERGY & TRANSPORTATION,METAL MINING,"333 NORTH CENTRAL AVENUE, PHOENIX, AZ, US",https://fcx.com,December,2024-09-30,58368098000,9900000000,29.43,10.66,12.21,0.6,0.0147,1.38,17.84,0.0781,0.29,0.0864,0.169,25639999000,9710000000,1.38,0.161,0.166,52.92,5,10,7,1,0,29.43,18.87,2.276,3.336,2.466,6.3,1.91,54.91,35.93,45.45,46.74,1436930000,2024-11-01,2024-10-15,40.62
TFC,Common Stock,Truist Financial Corp,"Truist Financial Corporation is an American bank holding company headquartered in Charlotte, North Carolina. Its bank operates 2,781 branches in 15 states and Washington, D.C., and offers consumer and commercial banking, securities brokerage, asset management, mortgage, and insurance products and services.",92230,NYSE,USD,USA,FINANCE,NATIONAL COMMERCIAL BANKS,"214 NORTH TRYON STREET, CHARLOTTE, NC, US",https://www.truist.com,December,2024-09-30,60123542000,None,None,1.944,44.46,2.08,0.0459,-4.84,10.86,-0.107,0.403,-0.0114,-0.0951,14497000000,22258000000,-4.84,0.239,0.061,49.86,4,6,13,0,0,-,11.34,4.147,1.015,7.15,-,1.035,49.05,32.99,45.05,41.02,1327520000,2024-12-02,2024-11-08,45.29
NGG,Common Stock,National Grid PLC ADR,"National Grid plc transmits and distributes electricity and natural gas. The company is headquartered in London, the United Kingdom.",1004315,NYSE,USD,USA,ENERGY & TRANSPORTATION,NATURAL GAS TRANSMISSION,"1-3 STRAND, LONDON, GB",https://www.nationalgrid.com,March,2024-03-31,58047226000,6679000000,22.85,1.774,7.92,0.55,0.0591,2.6,3.913,0.0936,0.158,0.0316,0.0528,19321999000,18449000000,2.6,-0.824,-0.062,67.82,1,1,0,0,0,22.85,12.59,3.004,1.276,4.329,13.38,0.268,70.28,50.46,64.0,64.78,977226000,2025-01-14,2024-11-22,59.40
AFL,Common Stock,Aflac Incorporated,Aflac Inc. (American Family Life Assurance Company) is an American insurance company and is the largest provider of supplemental insurance in the United States.,4977,NYSE,USD,USA,FINANCE,ACCIDENT & HEALTH INSURANCE,"1932 WYNNTON RD, COLUMBUS, GA, US",https://www.aflac.com,December,2024-09-30,57080500000,4779250000,15.27,0.93,44.6,1.92,0.0223,6.73,30.37,0.22,0.0482,0.0235,0.16,17302000000,8080000000,6.73,0.144,-0.404,105.77,2,1,8,1,1,15.27,14.47,3.299,2.323,3.686,-,0.958,115.43,73.5,109.93,97.31,555528000,2025-03-03,2025-02-19,102.75
NSC,Common Stock,Norfolk Southern Corporation,"The Norfolk Southern Railway is a Class I freight railroad in the United States, and is the current name of the former Southern Railway. With headquarters in Atlanta, Georgia, the company operates 19,420 route miles (31,250 km) in 22 eastern states, the District of Columbia, and has rights in Canada over the Albany to Montreal route of the Canadian Pacific Railway, and previously on CN from Buffalo to St. Thomas.",702165,NYSE,USD,USA,ENERGY & TRANSPORTATION,"RAILROADS, LINE-HAUL OPERATING","THREE COMMERCIAL PL, NORFOLK, VA, US",https://www.norfolksouthern.com,December,2024-09-30,54856413000,5888000000,22.75,2.158,60.93,5.4,0.0222,10.66,53.86,0.199,0.499,0.0677,0.183,12172000000,6156000000,10.66,1.31,0.027,277.64,5,11,11,1,0,22.75,17.86,4.507,3.979,5.84,13.68,1.302,277.6,204.47,258.5,243.72,226240000,2024-11-20,2024-11-01,242.47
SLB,Common Stock,Schlumberger NV,"Schlumberger Limited is an oilfield services company. Schlumberger has four principal executive offices located in Paris, Houston, London, and The Hague.",87347,NYSE,USD,USA,ENERGY & TRANSPORTATION,"OIL & GAS FIELD SERVICES, NEC","5599 SAN FELIPE, 17TH FLOOR, HOUSTON, TX, US",https://www.slb.com,December,2024-09-30,54975001000,8131000000,12.52,1.751,15.23,1.075,0.0283,3.11,25.25,0.124,0.18,0.0811,0.217,35995001000,5161000000,3.11,0.064,0.102,56.89,10,19,1,0,0,12.52,10.86,1.527,2.556,1.762,7.78,1.532,54.63,37.28,42.66,46.01,1412150000,2025-01-09,2024-12-04,38.93
HLT,Common Stock,Hilton Worldwide Holdings Inc,"Hilton Worldwide Holdings Inc., formerly Hilton Hotels Corporation, is an American multinational hospitality company that manages and franchises a broad portfolio of hotels and resorts.",1585689,NYSE,USD,USA,REAL ESTATE & CONSTRUCTION,HOTELS & MOTELS,"7930 JONES BRANCH DRIVE, SUITE 1100, MCLEAN, VA, US",https://www.hilton.com,December,2024-09-30,61010821000,2457000000,53.48,1.199,-14.19,0.6,0.0024,4.68,18.72,0.251,0.502,0.0908,0,4695000000,2737000000,4.68,-0.042,0.063,238.96,4,7,15,0,1,53.48,30.67,12.99,-,6.55,30.06,1.307,259.01,177.73,244.99,219.59,243780000,2024-12-27,2024-11-15,250.27
ROP,Common Stock,"Roper Technologies, Inc. Common Stock","Roper Technologies, Inc. (formerly Roper Industries, Inc.) is an American diversified industrial company that produces engineered products for global niche markets. The company is headquartered in Sarasota, Florida.",882835,NASDAQ,USD,USA,LIFE SCIENCES,"INDUSTRIAL INSTRUMENTS FOR MEASUREMENT, DISPLAY, AND CONTROL","6901 PROFESSIONAL PKWY EAST, SUITE 200, SARASOTA, FL, US",https://www.ropertech.com,December,2024-09-30,57555165000,2732700000,39.52,2.423,172.67,3,0.0061,13.58,63.29,0.218,0.281,0.0405,0.0824,6775600000,3752800000,13.58,0.054,0.129,605.95,3,7,6,0,1,39.52,26.74,8.49,3.108,9.69,22.73,1.029,580.09,506.83,553.67,547.44,107229000,2025-01-17,2025-01-03,536.75
KMI,Common Stock,Kinder Morgan Inc,"Kinder Morgan, Inc. is one of the largest energy infrastructure companies in North America. The company specializes in owning and controlling oil and gas pipelines and terminals.",1506307,NYSE,USD,USA,ENERGY & TRANSPORTATION,NATURAL GAS TRANSMISSION,"1001 LOUISIANA STREET, SUITE 1000, HOUSTON, TX, US",https://www.kindermorgan.com,December,2024-09-30,59117838000,6569000000,23.55,1.948,13.69,1.145,0.0433,1.13,6.82,0.168,0.275,0.0385,0.0835,15151000000,7290000000,1.13,0.181,-0.053,26.15,2,6,11,0,0,23.55,19.92,3.902,1.944,6.0,13.72,0.907,28.81,15.82,26.14,21.44,2221640000,2024-11-15,2024-10-31,26.61
PCAR,Common Stock,PACCAR Inc,"PACCAR Inc is an American Fortune 500 company and counts among the largest manufacturers of medium- and heavy-duty trucks in the world. PACCAR is engaged in the design, manufacture and customer support of light-, medium- and heavy-duty trucks under the Kenworth, Peterbilt, Leyland Trucks, and DAF nameplates. PACCAR also designs and manufactures powertrains, provides financial services and information technology, and distributes truck parts related to its principal business.",75362,NASDAQ,USD,USA,MANUFACTURING,MOTOR VEHICLES & PASSENGER CAR BODIES,"PACCAR BUILDING, 777 106TH AVENUE NE, BELLEVUE, WA, US",https://www.paccar.com,December,2024-09-30,58543452000,5908100000,12.49,1.181,35.6,1.14,0.0118,8.94,66.36,0.135,0.139,0.0846,0.271,34832900000,4612200000,8.94,-0.209,-0.052,114.45,2,5,12,1,1,12.49,14.04,1.681,3.137,1.857,10.2,0.89,124.43,89.52,110.87,107.01,524301000,2025-03-05,2024-12-20,111.66
GM,Common Stock,General Motors Company,"General Motors Company (GM) is an American multinational corporation headquartered in Detroit, Michigan that designs, manufactures, markets, and distributes vehicles and vehicle parts, and sells financial services, with global headquarters in Detroit's Renaissance Center.",1467858,NYSE,USD,USA,MANUFACTURING,MOTOR VEHICLES & PASSENGER CAR BODIES,"300 RENAISSANCE CENTER, DETROIT, MI, US",https://www.gm.com,December,2024-09-30,56244543000,18371000000,5.46,8.13,64.49,0.45,0.0094,9.37,155.11,0.0606,0.0786,0.027,0.142,182719005000,21154000000,9.37,0.218,0.105,59.4,7,10,8,2,1,5.46,4.88,0.308,0.81,0.838,6.03,1.414,61.1,33.97,52.94,47.13,1099600000,2024-12-19,2024-12-06,51.15
CM,Common Stock,Canadian Imperial Bank Of Commerce,"Canadian Imperial Bank of Commerce, a diversified financial institution, offers a variety of financial products and services to personal, commercial, public sector, and institutional clients in Canada, the United States, and internationally. The company is headquartered in Toronto, Canada.",1045520,NYSE,USD,USA,FINANCE,"COMMERCIAL BANKS, NEC","21 MELINDA STREET   CCE 7, TORONTO ONTARIO, ON, CA",https://www.cibc.com,October,2024-10-31,62070338000,None,12.87,3.032,58.37,0,0.0407,5.11,24.3,0.296,0.399,0.0069,0.124,22704001000,21313000000,5.11,0.238,0.196,60.46,5,4,4,0,2,12.87,11.99,2.734,1.64,8.56,-,1.128,67.45,42.24,63.71,54.46,942375000,2025-01-28,2024-09-27,65.87
PSA,Common Stock,Public Storage,"Public Storage is an American international self storage company headquartered in Glendale, California, that is run as a real estate investment trust (REIT).",1393311,NYSE,USD,USA,REAL ESTATE & CONSTRUCTION,REAL ESTATE INVESTMENT TRUSTS,"701 WESTERN AVENUE, GLENDALE, CA, US",https://www.publicstorage.com,December,2024-09-30,54895346000,3353046000,32.47,9.58,30.04,12,0.0383,9.65,26.78,0.404,0.47,0.0698,0.192,4698625000,3187137000,9.65,-0.325,0.034,348.67,4,5,9,1,1,32.47,28.01,11.68,10.44,14.56,20.42,0.69,366.53,249.04,336.6,308.88,175183000,2024-12-30,2024-12-13,313.36
MET,Common Stock,MetLife Inc,"MetLife, Inc. is the holding corporation for the Metropolitan Life Insurance Company (MLIC), better known as MetLife, and its affiliates. MetLife is among the largest global providers of insurance, annuities, and employee benefit programs, with 90 million customers in over 60 countries.",1099219,NYSE,USD,USA,FINANCE,LIFE INSURANCE,"200 PARK AVENUE, NEW YORK, NY, US",https://www.metlife.com,December,2024-09-30,56259121000,7036000000,16.48,0.142,44.52,2.13,0.0268,4.93,99.39,0.0527,0.151,0.0058,0.133,71343997000,14893000000,4.93,2.232,0.162,92.54,5,7,2,0,1,16.48,8.29,0.789,1.822,0.999,-,1.039,89.05,62.79,83.66,75.82,692420000,2024-12-16,2024-11-05,81.25
TGT,Common Stock,Target Corporation,"Target Corporation is an American retail corporation. Their retail formats include the discount store Target, the hypermarket SuperTarget, and small-format stores previously named CityTarget and TargetExpress before being consolidated under the Target branding.",27419,NYSE,USD,USA,TRADE & SERVICES,RETAIL-VARIETY STORES,"1000 NICOLLET MALL, MINNEAPOLIS, MN, US",https://corporate.target.com,January,2024-10-31,60300702000,9231000000,13.96,1.825,29.09,0,0.0287,9.43,232.23,0.0418,0.0664,0.0723,0.34,107300004000,26891000000,9.43,0.428,0.027,141.64,3,12,21,0,1,13.96,13.85,0.562,4.162,0.709,8.46,1.242,177.93,120.21,144.73,152.46,458212000,2024-12-10,2024-11-20,131.60
