Symbol,AssetType,Name,Description,CIK,Exchange,Currency,Country,Sector,Industry,Address,OfficialSite,FiscalYearEnd,LatestQuarter,MarketCapitalization,EBITDA,PERatio,PEGRatio,BookValue,DividendPerShare,DividendYield,EPS,RevenuePerShareTTM,ProfitMargin,OperatingMarginTTM,ReturnOnAssetsTTM,ReturnOnEquityTTM,RevenueTTM,GrossProfitTTM,DilutedEPSTTM,QuarterlyEarningsGrowthYOY,QuarterlyRevenueGrowthYOY,AnalystTargetPrice,AnalystRatingStrongBuy,AnalystRatingBuy,AnalystRatingHold,AnalystRatingSell,AnalystRatingStrongSell,TrailingPE,ForwardPE,PriceToSalesRatioTTM,PriceToBookRatio,EVToRevenue,EVToEBITDA,Beta,52WeekHigh,52WeekLow,50DayMovingAverage,200DayMovingAverage,SharesOutstanding,DividendDate,ExDividendDate,PricePerShare
AAPL,Common Stock,Apple Inc,"Apple Inc. is an American multinational technology company that specializes in consumer electronics, computer software, and online services. Apple is the world's largest technology company by revenue (totalling $274.5 billion in 2020) and, since January 2021, the world's most valuable company. As of 2021, Apple is the world's fourth-largest PC vendor by unit sales, and fourth-largest smartphone manufacturer. It is one of the Big Five American information technology companies, along with Amazon, Google, Microsoft, and Facebook.",320193,NASDAQ,USD,USA,TECHNOLOGY,ELECTRONIC COMPUTERS,"ONE INFINITE LOOP, CUPERTINO, CA, US",https://www.apple.com,September,2024-09-30,3831552803000,134660997000,41.69,2.619,3.767,0.98,0.004,6.08,25.48,0.24,0.312,0.215,1.574,391034995000,170782000000,6.08,-0.341,0.061,246.26,8,24,12,1,2,41.69,34.01,9.8,67.28,9.9,28.76,1.24,254.28,163.49,232.83,209.31,15115800000,2024-11-14,2024-11-08,253.48
NVDA,Common Stock,NVIDIA Corporation,"Nvidia Corporation is an American multinational technology company incorporated in Delaware and based in Santa Clara, California. It designs graphics processing units (GPUs) for the gaming and professional markets, as well as system on a chip units (SoCs) for the mobile computing and automotive market.",1045810,NASDAQ,USD,USA,MANUFACTURING,SEMICONDUCTORS & RELATED DEVICES,"2701 SAN TOMAS EXPRESSWAY, SANTA CLARA, CA, US",https://www.nvidia.com,January,2024-10-31,3193251037000,61184000000,51.54,0.812,1.744,0,0.0003,2.53,3.91,0.55,0.621,0.553,1.238,96307003000,44301000000,2.53,1.68,1.224,172.38,12,48,4,0,0,51.54,30.58,33.16,48.46,27.94,42.27,1.657,152.88,47.31,139.69,115.52,24490000000,2024-12-27,2024-09-12,130.39
MSFT,Common Stock,Microsoft Corporation,"Microsoft Corporation is an American multinational technology company which produces computer software, consumer electronics, personal computers, and related services. Its best known software products are the Microsoft Windows line of operating systems, the Microsoft Office suite, and the Internet Explorer and Edge web browsers. Its flagship hardware products are the Xbox video game consoles and the Microsoft Surface lineup of touchscreen personal computers. Microsoft ranked No. 21 in the 2020 Fortune 500 rankings of the largest United States corporations by total revenue; it was the world's largest software maker by revenue as of 2016. It is considered one of the Big Five companies in the U.S. information technology industry, along with Google, Apple, Amazon, and Facebook.",789019,NASDAQ,USD,USA,TECHNOLOGY,SERVICES-PREPACKAGED SOFTWARE,"ONE MICROSOFT WAY, REDMOND, WA, US",https://www.microsoft.com,June,2024-09-30,3378855543000,136551997000,37.56,2.407,38.69,3.08,0.0074,12.1,34.2,0.356,0.466,0.146,0.356,254189994000,165359000000,12.1,0.104,0.16,506.98,13,37,5,0,0,37.56,34.48,13.29,11.74,13.23,24.1,0.904,466.57,363.78,424.7,423.95,7434880000,2025-03-13,2025-02-20,454.46
AMZN,Common Stock,Amazon.com Inc,"Amazon.com, Inc. is an American multinational technology company which focuses on e-commerce, cloud computing, digital streaming, and artificial intelligence. It is one of the Big Five companies in the U.S. information technology industry, along with Google, Apple, Microsoft, and Facebook. The company has been referred to as one of the most influential economic and cultural forces in the world, as well as the world's most valuable brand.",1018724,NASDAQ,USD,USA,TRADE & SERVICES,RETAIL-CATALOG & MAIL-ORDER HOUSES,"410 TERRY AVENUE NORTH, SEATTLE, WA, US",https://www.aboutamazon.com,December,2024-09-30,2430542283000,111583003000,49.39,1.907,24.66,None,None,4.68,59.49,0.0804,0.11,0.0707,0.226,620127977000,225152000000,4.68,0.521,0.11,237.92,17,46,4,0,0,49.39,37.17,3.919,9.38,3.995,21.83,1.146,233,144.05,202.19,187.28,10515000000,None,None,231.15
GOOG,Common Stock,Alphabet Inc Class C,"Alphabet Inc. is an American multinational conglomerate headquartered in Mountain View, California. It was created through a restructuring of Google on October 2, 2015, and became the parent company of Google and several former Google subsidiaries. The two co-founders of Google remained as controlling shareholders, board members, and employees at Alphabet. Alphabet is the world's fourth-largest technology company by revenue and one of the world's most valuable companies.",1652044,NASDAQ,USD,USA,TECHNOLOGY,"SERVICES-COMPUTER PROGRAMMING, DATA PROCESSING, ETC.","1600 AMPHITHEATRE PARKWAY, MOUNTAIN VIEW, CA, US",https://abc.xyz,December,2024-09-30,2401552302000,123469996000,26.11,1.24,25.61,0.4,0.004,7.55,27.44,0.277,0.323,0.165,0.321,339859014000,156633000000,7.55,0.366,0.151,206.69,14,37,10,0,0,26.11,22.32,7.07,7.72,6.91,18.54,1.034,202.88,131.08,173.74,168.19,5534000000,2024-12-16,2024-12-09,433.96
GOOGL,Common Stock,Alphabet Inc Class A,"Alphabet Inc. is an American multinational conglomerate headquartered in Mountain View, California. It was created through a restructuring of Google on October 2, 2015, and became the parent company of Google and several former Google subsidiaries. The two co-founders of Google remained as controlling shareholders, board members, and employees at Alphabet. Alphabet is the world's fourth-largest technology company by revenue and one of the world's most valuable companies.",1652044,NASDAQ,USD,USA,TECHNOLOGY,"SERVICES-COMPUTER PROGRAMMING, DATA PROCESSING, ETC.","1600 AMPHITHEATRE PARKWAY, MOUNTAIN VIEW, CA, US",https://abc.xyz,December,2024-09-30,2400382878000,123469996000,25.95,1.223,25.61,0.4,0.0041,7.53,27.44,0.277,0.323,0.165,0.321,339859014000,156633000000,7.53,0.366,0.151,209.85,14,37,11,0,0,25.95,22.03,7.06,7.62,6.87,18.43,1.034,201.42,130.19,172.18,166.71,5843000000,2024-12-16,2024-12-09,410.81
META,Common Stock,Meta Platforms Inc.,"Meta Platforms, Inc. develops products that enable people to connect and share with friends and family through mobile devices, PCs, virtual reality headsets, wearables and home devices around the world. The company is headquartered in Menlo Park, California.",1326801,NASDAQ,USD,USA,TECHNOLOGY,"SERVICES-COMPUTER PROGRAMMING, DATA PROCESSING, ETC.","1601 WILLOW ROAD, MENLO PARK, CA, US",https://investor.fb.com,December,2024-09-30,1563770094000,79208997000,29.25,1.003,65.19,1.5,0.0032,21.18,61.43,0.355,0.428,0.172,0.361,156226994000,92855000000,21.18,0.374,0.189,650.56,12,47,8,0,2,29.25,24.63,10.01,9.58,9.95,19.74,1.215,637.89,338.72,585.07,522.94,2180000000,2024-12-27,2024-12-16,717.33
TSLA,Common Stock,Tesla Inc,"Tesla, Inc. is an American electric vehicle and clean energy company based in Palo Alto, California. Tesla's current products include electric cars, battery energy storage from home to grid-scale, solar panels and solar roof tiles, as well as other related products and services. In 2020, Tesla had the highest sales in the plug-in and battery electric passenger car segments, capturing 16% of the plug-in market (which includes plug-in hybrids) and 23% of the battery-electric (purely electric) market. Through its subsidiary Tesla Energy, the company develops and is a major installer of solar photovoltaic energy generation systems in the United States. Tesla Energy is also one of the largest global suppliers of battery energy storage systems, with 3 GWh of battery storage supplied in 2020.",1318605,NASDAQ,USD,USA,MANUFACTURING,MOTOR VEHICLES & PASSENGER CAR BODIES,"3500 DEER CREEK RD, PALO ALTO, CA, US",https://www.tesla.com,December,2024-09-30,1540379378000,13244000000,131.11,12.84,21.81,None,None,3.66,30.46,0.131,0.108,0.0476,0.204,97150001000,20853000000,3.66,0.17,0.078,277.85,5,13,17,8,5,131.11,135.14,15.86,21.25,15.08,105.93,2.295,488.54,138.8,304.33,225.7,3210060000,None,None,479.86
TSM,Common Stock,Taiwan Semiconductor Manufacturing,"Taiwan Semiconductor Manufacturing Company, Limited is a Taiwanese multinational semiconductor contract manufacturing and design company. It is one of Taiwan's largest companies, the world's most valuable semiconductor company, and the world's largest dedicated independent (pure-play) semiconductor foundry, with its headquarters and main operations located in the Hsinchu Science Park in Hsinchu, Taiwan. It is majority owned by foreign investors.",1046179,NYSE,USD,USA,MANUFACTURING,SEMICONDUCTORS & RELATED DEVICES,"NO. 8, LI-HSIN ROAD 6, SCIENCE-BASED INDUSTRIAL PARK, HSINCHU, TW",https://www.tsmc.com,December,2024-09-30,1040733110000,1797362418000,32.16,1.289,153.89,15.5,0.0138,6.24,63.91,0.391,0.475,0.124,0.28,2651375796000,1348354806000,6.24,0.541,0.39,229.96,4,12,1,0,0,32.16,22.57,0.393,8.46,9.81,13.77,1.232,211.93,97.42,193.46,167.48,5186550000,2025-04-10,2025-03-18,200.66
AVGO,Common Stock,Broadcom Inc,"Broadcom Inc. is an American designer, developer, manufacturer and global supplier of a wide range of semiconductor and infrastructure software products. Broadcom's product offerings serve the data center, networking, software, broadband, wireless, and storage and industrial markets.",1730168,NASDAQ,USD,USA,MANUFACTURING,SEMICONDUCTORS & RELATED DEVICES,"1320 RIDDER PARK DRIVE, SAN JOSE, CA, US",https://www.broadcom.com,October,2024-10-31,1122013413000,22958000000,184.79,0.724,59.22,0,0.0117,1.3,10.43,0.109,0.318,0.077,0.125,46814999000,24947000000,1.3,1.881,0.164,226.39,8,29,5,0,0,184.79,40.16,23.97,17.25,23.77,51.34,1.187,251.88,103.04,176.42,155.45,4670580000,2024-12-31,2024-09-19,240.23
LLY,Common Stock,Eli Lilly and Company,"Eli Lilly and Company is an American pharmaceutical company headquartered in Indianapolis, Indiana, with offices in 18 countries. Its products are sold in approximately 125 countries.",59478,NYSE,USD,USA,LIFE SCIENCES,PHARMACEUTICAL PREPARATIONS,"LILLY CORPORATE CTR, DROP CODE 1094, INDIANAPOLIS, IN, US",https://www.lilly.com,December,2024-09-30,700225421000,16566500000,83.99,0.737,15.82,5.03,0.0077,9.27,45.37,0.205,0.398,0.14,0.653,40863302000,21911600000,9.27,0.682,0.204,984.05,6,15,5,0,1,83.99,34.6,17.14,49.17,17.81,58.16,0.43,970.92,563.34,833.21,838.75,899316000,2025-03-10,2025-02-14,778.62
WMT,Common Stock,Walmart Inc,"Walmart Inc. is an American multinational retail corporation that operates a chain of hypermarkets, discount department stores, and grocery stores from the United States, headquartered in Bentonville, Arkansas. It also owns and operates Sam's Club retail warehouses.",104169,NYSE,USD,USA,TRADE & SERVICES,RETAIL-VARIETY STORES,"702 SOUTHWEST 8TH ST, BENTONVILLE, AR, US",https://corporate.walmart.com,January,2024-10-31,766546084000,40779002000,39.43,2.869,10.41,0,0.0099,2.42,82.5,0.0234,0.0469,0.0695,0.185,665035014000,147568000000,2.42,-0.423,0.048,98.09,13,25,3,1,0,39.43,34.6,1.153,8.7,1.214,19.35,0.516,95.97,50.7,86.15,72.25,8033390000,2025-01-06,2024-12-12,95.42
JPM,Common Stock,JPMorgan Chase & Co,"JPMorgan Chase & Co. is an American multinational investment bank and financial services holding company headquartered in New York City. JPMorgan Chase is incorporated in Delaware. As a Bulge Bracket bank, it is a major provider of various investment banking and financial services. It is one of America's Big Four banks, along with Bank of America, Citigroup, and Wells Fargo. JPMorgan Chase is considered to be a universal bank and a custodian bank. The J.P. Morgan brand is used by the investment banking, asset management, private banking, private wealth management, and treasury services divisions.",19617,NYSE,USD,USA,FINANCE,NATIONAL COMMERCIAL BANKS,"383 MADISON AVENUE, NEW YORK, NY, US",https://www.jpmorganchase.com,December,2024-09-30,671064457000,None,13.25,4.739,115.15,4.6,0.0209,17.99,56.04,0.332,0.438,0.0133,0.162,162148008000,122306000000,17.99,0.009,0.03,246.56,7,6,7,2,0,13.25,14.22,4.139,2.081,5.22,-,1.091,254.31,161.46,233.85,209.89,2815340000,2025-01-31,2025-01-06,238.36
V,Common Stock,Visa Inc. Class A,"Visa Inc. is an American multinational financial services corporation headquartered in Foster City, California, United States. It facilitates electronic funds transfers throughout the world, most commonly through Visa-branded credit cards, debit cards and prepaid cards. Visa is one of the world's most valuable companies.",1403161,NYSE,USD,USA,TRADE & SERVICES,"SERVICES-BUSINESS SERVICES, NEC","P.O. BOX 8999, SAN FRANCISCO, CA, US",https://www.visa.com,September,2024-09-30,616378401000,24973001000,32.68,2.093,20.08,2.15,0.0074,9.74,19.59,0.55,0.661,0.162,0.507,35926000000,31917000000,9.74,0.169,0.117,326.49,11,18,9,0,0,32.68,28.17,17.16,16.05,17.21,24.16,0.952,321.62,251.71,299.32,280.09,1729400000,2024-12-02,2024-11-12,356.41
UNH,Common Stock,UnitedHealth Group Incorporated,"UnitedHealth Group Incorporated is an American for-profit multinational managed healthcare and insurance company based in Minnetonka, Minnesota. It offers health care products and insurance services. In 2020, it was the second-largest healthcare company (behind CVS Health) by revenue with $257.1 billion, and the largest insurance company by net premiums. UnitedHealthcare revenues comprise 80% of the Group's overall revenue.",731766,NYSE,USD,USA,FINANCE,HOSPITAL & MEDICAL SERVICE PLANS,"UNITEDHEALTH GROUP CENTER, 9900 BREN ROAD EAST, MINNEAPOLIS, MN, US",https://www.unitedhealthgroup.com,December,2024-09-30,446816289000,35035001000,31.55,1.343,102.42,7.96,0.0173,15.39,427.22,0.0364,0.0864,0.0692,0.152,393898000000,79617000000,15.39,0.043,0.092,636.05,5,19,4,0,0,31.55,16.29,1.134,4.726,1.254,17.48,0.591,628.32,431.35,579.65,538.35,920284000,2024-12-17,2024-12-09,485.52
XOM,Common Stock,Exxon Mobil Corp,"Exxon Mobil Corporation, stylized as ExxonMobil, is an American multinational oil and gas corporation headquartered in Irving, Texas. It is the largest direct descendant of John D. Rockefeller's Standard Oil, and was formed on November 30, 1999 by the merger of Exxon (formerly the Standard Oil Company of New Jersey) and Mobil (formerly the Standard Oil Company of New York). ExxonMobil's primary brands are Exxon, Mobil, Esso, and ExxonMobil Chemical. ExxonMobil is incorporated in New Jersey.",34088,NYSE,USD,USA,ENERGY & TRANSPORTATION,PETROLEUM REFINING,"5959 LAS COLINAS BLVD, IRVING, TX, US",https://corporate.exxonmobil.com,December,2024-09-30,474713686000,71538000000,13.45,5.51,61.11,3.8,0.0365,8.03,81.88,0.098,0.133,0.0708,0.145,343818011000,133715000000,8.03,-0.147,-0.015,130.58,7,8,12,0,1,13.45,12.18,1.381,1.767,1.443,6.52,0.88,125.31,92.61,118.65,116.28,4395090000,2024-12-10,2024-11-14,108.01
ORCL,Common Stock,Oracle Corporation,"Oracle is an American multinational computer technology corporation headquartered in Austin, Texas. The company was formerly headquartered in Redwood Shores, California until December 2020 when it moved its headquarters to Texas. The company sells database software and technology, cloud engineered systems, and enterprise software products, particularly its own brands of database management systems.",1341439,NYSE,USD,USA,TECHNOLOGY,SERVICES-PREPACKAGED SOFTWARE,"500 ORACLE PARKWAY, MAIL STOP 5 OP 7, REDWOOD CITY, CA, US",https://www.oracle.com,May,2024-11-30,474672103000,21803000000,41.49,1.825,3.159,0,0.0083,4.09,19.55,0.204,0.305,0.0729,1.556,53815001000,36390000000,4.09,0.198,0.069,196.55,5,16,13,0,0,41.49,27.55,8.82,34.53,10.05,24.31,1.013,198.31,100.51,180.16,145.52,2796960000,2025-01-23,2024-10-10,169.71
MA,Common Stock,Mastercard Inc,"Mastercard Incorporated is an American multinational financial services corporation headquartered in the Mastercard International Global Headquarters in Purchase, New York. The Global Operations Headquarters is located in O'Fallon, Missouri, a municipality of St. Charles County, Missouri. Throughout the world, its principal business is to process payments between the banks of merchants and the card-issuing banks or credit unions of the purchasers who use the Mastercard brand debit, credit and prepaid cards to make purchases. Mastercard Worldwide has been a publicly traded company since 2006.",1141391,NYSE,USD,USA,TRADE & SERVICES,"SERVICES-BUSINESS SERVICES, NEC","2000 PURCHASE STREET, PURCHASE, NY, US",https://www.mastercard.com,December,2024-09-30,487377437000,16784000000,40.23,2.026,8.09,2.64,0.005,13.2,29.28,0.453,0.593,0.229,1.776,27225999000,22237000000,13.2,0.041,0.128,560.72,10,21,8,0,0,40.23,32.47,17.9,65.42,18.13,30.54,1.101,537.13,414.59,517.21,476.79,910768000,2024-11-08,2024-10-09,535.13
NVO,Common Stock,Novo Nordisk A/S,"Novo Nordisk A / S, a healthcare company, is dedicated to the research, development, manufacture and marketing of pharmaceutical products globally. The company is headquartered in Bagsvaerd, Denmark.",353278,NYSE,USD,USA,LIFE SCIENCES,PHARMACEUTICAL PREPARATIONS,"NOVO ALLE DK 2880, BAGSVAERD DENMARK, DK",https://www.novonordisk.com,December,2024-09-30,486491095000,127400698000,36.12,1.608,27.07,9.9,0.0134,2.99,60.7,0.35,0.474,0.215,0.887,270583005000,148506000000,2.99,0.224,0.214,133.41,2,5,2,1,1,36.12,27.55,1.798,28.23,12.69,25.2,0.165,147.59,99.42,110.62,126.8,3366780000,2024-08-26,2024-08-16,144.50
COST,Common Stock,Costco Wholesale Corp,"Costco Wholesale Corporation (doing business as Costco Wholesale and also known simply as Costco) is an American multinational corporation which operates a chain of membership-only (needing a membership to shop there) big-box retail stores. As of 2020, Costco was the fifth largest retailer in the world, and the world's largest retailer of choice and prime beef, organic foods, rotisserie chicken, and wine as of 2016.",909832,NASDAQ,USD,USA,TRADE & SERVICES,RETAIL-VARIETY STORES,"999 LAKE DRIVE, ISSAQUAH, WA, US",https://www.costco.com,August,2024-11-30,435986596000,11522000000,57.84,5.99,53.31,0,0.0047,16.98,573.2,0.029,0.0382,0.0836,0.303,254453006000,30095000000,16.98,0.088,0.01,1013.5,7,17,13,1,0,57.84,54.35,1.713,17.83,1.67,34.88,0.789,1008.25,636.79,927.42,843.23,443942000,2024-11-15,2024-11-01,982.08
HD,Common Stock,Home Depot Inc,"The Home Depot, Inc., commonly known as Home Depot, is the largest home improvement retailer in the United States, supplying tools, construction products, and services. The company is headquartered in incorporated Cobb County, Georgia, with an Atlanta mailing address.",354950,NYSE,USD,USA,TRADE & SERVICES,RETAIL-LUMBER & OTHER BUILDING MATERIALS DEALERS,"2455 PACES FERRY ROAD, ATLANTA, GA, US",https://www.homedepot.com,January,2024-10-31,405759001000,24758000000,27.69,5.27,5.84,2.25,0.022,14.75,156.16,0.0945,0.135,0.153,0.405,154596000000,52778000000,14.75,-0.037,0.066,431.41,5,21,12,2,0,27.69,25.84,2.625,70.13,3.025,18.72,1.011,437.07,317.92,411.42,371.3,993363000,2024-12-12,2024-11-27,408.47
PG,Common Stock,Procter & Gamble Company,"The Procter & Gamble Company (P&G) is an American multinational consumer goods corporation headquartered in Cincinnati, Ohio, founded in 1837 by William Procter and James Gamble. It specializes in a wide range of personal health, consumer health, personal care, and hygiene products; these products are organized into several segments including Beauty; Grooming; Health Care; Fabric & Home Care; and Baby, Feminine, & Family Care. Before the sale of Pringles to Kellogg's, its product portfolio also included food, snacks, and beverages.",80424,NYSE,USD,USA,LIFE SCIENCES,"SOAP, DETERGENTS, CLEANG PREPARATIONS, PERFUMES, COSMETICS","ONE PROCTER & GAMBLE PLAZA, CINCINNATI, OH, US",https://www.pginvestor.com,June,2024-09-30,401133961000,24039999000,29.37,3.599,21.68,3.894,0.0235,5.8,35.57,0.171,0.278,0.106,0.288,83905004000,39246000000,5.8,-0.121,-0.006,181.07,4,13,10,0,1,29.37,24.45,4.781,7.86,5.08,19.4,0.414,180.43,139.65,170.56,167.19,2355040000,2024-11-15,2024-10-18,170.33
NFLX,Common Stock,Netflix Inc,"Netflix, Inc. is an American over-the-top content platform and production company headquartered in Los Gatos, California. Netflix was founded in 1997 by Reed Hastings and Marc Randolph in Scotts Valley, California. The company's primary business is a subscription-based streaming service offering online streaming from a library of films and television series, including those produced in-house.",1065280,NASDAQ,USD,USA,TRADE & SERVICES,SERVICES-VIDEO TAPE RENTAL,"100 WINCHESTER CIRCLE, ., LOS GATOS, CA, US",https://www.netflix.com,December,2024-09-30,392889467000,9976899000,52.08,1.883,53.15,None,None,17.65,87.11,0.207,0.296,0.118,0.347,37587280000,12447265000,17.65,0.448,0.15,821.63,8,20,15,1,2,52.08,38.61,10.47,17.33,10.65,16.05,1.25,941.75,461.86,814.93,687.0,427458000,None,None,919.13
JNJ,Common Stock,Johnson & Johnson,"Johnson & Johnson (J&J) is an American multinational corporation founded in 1886 that develops medical devices, pharmaceuticals, and consumer packaged goods. Its common stock is a component of the Dow Jones Industrial Average and the company is ranked No. 36 on the 2021 Fortune 500 list of the largest United States corporations by total revenue. Johnson & Johnson is one of the world's most valuable companies, and is one of only two U.S.-based companies that has a prime credit rating of AAA, higher than that of the United States government.",200406,NYSE,USD,USA,LIFE SCIENCES,PHARMACEUTICAL PREPARATIONS,"ONE JOHNSON & JOHNSON PLZ, NEW BRUNSWICK, NJ, US",https://www.jnj.com,December,2024-09-30,352499663000,30052000000,24.16,0.878,29.14,4.86,0.0345,6.06,36.43,0.167,0.245,0.084,0.209,87695999000,63954000000,6.06,-0.891,0.052,174.28,3,8,13,0,0,24.16,13.77,4.02,5.02,4.196,14.33,0.518,167.51,139.79,156.5,155.21,2407620000,2024-12-10,2024-11-26,146.41
BAC,Common Stock,Bank of America Corp,"The Bank of America Corporation is an American multinational investment bank and financial services holding company headquartered in Charlotte, North Carolina. Founded in San Francisco, Bank of America was formed through NationsBank's acquisition of BankAmerica in 1998. It is the second largest banking institution in the United States, after JPMorgan Chase, and the eighth largest bank in the world. Bank of America is one of the Big Four banking institutions of the United States. It services approximately 10 percent of all American bank deposits, in direct competition with JPMorgan Chase, Citigroup and Wells Fargo. Its primary financial services revolve around commercial banking, wealth management, and investment banking.",70858,NYSE,USD,USA,FINANCE,NATIONAL COMMERCIAL BANKS,"BANK OF AMERICA CORPORATE CENTER, 100 N TRYON ST, CHARLOTTE, NC, US",https://www.bankofamerica.com,December,2024-09-30,345663242000,None,16.32,1.996,35.37,0.98,0.0229,2.76,11.95,0.249,0.308,0.0073,0.0809,94625997000,92407000000,2.76,-0.1,-0.005,49.13,8,8,5,0,1,16.32,12.18,3.653,1.271,7.16,-,1.325,47.81,30.49,44.34,40.22,7672880000,2024-12-27,2024-12-06,45.05
ABBV,Common Stock,AbbVie Inc,AbbVie is an American publicly traded biopharmaceutical company founded in 2013. It originated as a spin-off of Abbott Laboratories.,1551152,NYSE,USD,USA,LIFE SCIENCES,PHARMACEUTICAL PREPARATIONS,"1 NORTH WAUKEGAN ROAD, NORTH CHICAGO, IL, US",https://www.abbvie.com,December,2024-09-30,309921022000,25629999000,60.9,0.419,3.413,6.2,0.0374,2.88,31.4,0.0922,0.289,0.0772,0.564,55532999000,41527000000,2.88,-0.123,0.038,202.54,8,13,8,0,0,60.9,14.79,5.58,51.38,6.73,20.5,0.613,207.32,145.95,184.37,178.94,1767140000,2025-02-14,2025-01-15,175.38
CRM,Common Stock,Salesforce.com Inc,"Salesforce.com, Inc. is an American cloud-based software company headquartered in San Francisco, California. It provides customer relationship management (CRM) service and also provides a complementary suite of enterprise applications focused on customer service, marketing automation, analytics, and application development.",1108524,NYSE,USD,USA,TECHNOLOGY,SERVICES-PREPACKAGED SOFTWARE,"THE LANDMARK, ONE MARKET STREET STE.300, SAN FRANCISCO, CA, US",https://www.salesforce.com,January,2024-10-31,335878291000,9345000000,57.82,1.579,61.43,0,0.0048,6.07,37.63,0.154,0.202,0.0471,0.0973,36465000000,22992000000,6.07,0.148,0.084,396.2,15,25,11,0,1,57.82,31.45,9.21,5.74,9.0,30.7,1.288,368.58,211.1,318.0,280.24,957000000,2025-01-09,2024-09-18,350.97
SMFG,Common Stock,Sumitomo Mitsui Financial Group Inc,"Sumitomo Mitsui Financial Group, Inc. provides commercial banking, finance leasing, securities, consumer finance, and other services primarily in Japan. The company is headquartered in Tokyo, Japan.",1022837,NYSE,USD,USA,FINANCE,"COMMERCIAL BANKS, NEC","1-2, MARUNOUCHI 1-CHOME, CHIYODA-KU, TOKYO, JP",https://www.smfg.co.jp,March,2024-09-30,93533463000,None,12.5,1.073,3724.09,0,0.0245,1.15,567.48,0.269,0.405,0.0035,0.0714,3754061988000,3988548000000,1.15,0.525,0.183,16.46,0,1,0,0,0,12.5,10.73,0.0249,0.977,5.93,-,0.561,15.56,8.92,13.72,12.84,6508940000,2024-12-10,2024-03-27,14.37
