Symbol,AssetType,Name,Description,CIK,Exchange,Currency,Country,Sector,Industry,Address,OfficialSite,FiscalYearEnd,LatestQuarter,MarketCapitalization,EBITDA,PERatio,PEGRatio,BookValue,DividendPerShare,DividendYield,EPS,RevenuePerShareTTM,ProfitMargin,OperatingMarginTTM,ReturnOnAssetsTTM,ReturnOnEquityTTM,RevenueTTM,GrossProfitTTM,DilutedEPSTTM,QuarterlyEarningsGrowthYOY,QuarterlyRevenueGrowthYOY,AnalystTargetPrice,AnalystRatingStrongBuy,AnalystRatingBuy,AnalystRatingHold,AnalystRatingSell,AnalystRatingStrongSell,TrailingPE,ForwardPE,PriceToSalesRatioTTM,PriceToBookRatio,EVToRevenue,EVToEBITDA,Beta,52WeekHigh,52WeekLow,50DayMovingAverage,200DayMovingAverage,SharesOutstanding,DividendDate,ExDividendDate,PricePerShare
KKR,Common Stock,KKR & Co LP,None,1404912,NYSE,USD,USA,FINANCE,INVESTMENT ADVICE,"9 WEST 57TH STREET, SUITE 4200, NEW YORK, NY, US",https://www.kkr.com,December,2024-09-30,139554734000,None,46.68,0.673,27.14,0.69,0.0046,3.24,31.39,0.107,0.262,0.0157,0.0828,27816323000,2337084000,3.24,-0.61,0.238,166.49,6,11,2,0,1,46.68,24.33,5.02,5.58,3.01,7.34,1.606,163.68,78.46,147.56,118.81,888229000,2024-11-19,2024-11-04,157.12
PDD,Common Stock,PDD Holdings Inc.,"Pinduoduo Inc., operates an electronic commerce platform in the People's Republic of China. The company is headquartered in Shanghai, the People's Republic of China.",1737806,NASDAQ,USD,China,TRADE & SERVICES,"SERVICES-BUSINESS SERVICES, NEC","28/F, NO. 533 LOUSHANGUAN ROAD, CHANGNING DISTRICT, SHANGHAI, CHINA",https://www.pddholdings.com,December,2024-09-30,142237827000,97656447000,10.14,0.359,136.09,None,None,10.1,248.59,0.289,0.336,0.172,0.495,341592998000,99095291000,10.1,1.4,0.857,149.72,7,31,7,0,0,10.14,7.67,0.416,3.615,1.904,5.57,0.705,164.69,88.01,116.97,125.72,1388770000,None,None,102.42
BX,Common Stock,Blackstone Group Inc,"Blackstone Group Inc. is an alternative asset management company specializing in real estate, private equity, hedge fund solutions, credit, secondary funds of funds, public debt and equity strategies and multiple asset classes. The company is headquartered in New York, New York with additional offices across Asia, Europe and North America.",1393818,NYSE,USD,USA,FINANCE,INVESTMENT ADVICE,"345 PARK AVENUE, NEW YORK, NY, US",https://www.blackstone.com,December,2024-09-30,222090461000,None,62.92,2.269,9.13,3.45,0.0188,2.91,14.51,0.2,0.511,0.1,0.22,11138276000,7053217000,2.91,0.396,0.541,176.7,1,7,15,0,1,62.92,31.55,19.94,19.84,16.17,-,1.486,200.96,112.01,176.13,142.24,722003000,2024-11-04,2024-10-28,307.60
C,Common Stock,Citigroup Inc,"Citigroup Inc. is an American multinational investment bank and financial services corporation headquartered in New York City. The company was formed by the merger of banking giant Citicorp and financial conglomerate Travelers Group in 1998; Travelers was subsequently spun off from the company in 2002. Citigroup owns Citicorp, the holding company for Citibank, as well as several international subsidiaries. Citigroup is incorporated in Delaware.",831001,NYSE,USD,USA,FINANCE,NATIONAL COMMERCIAL BANKS,"388 GREENWICH STREET, NEW YORK, NY, US",https://www.citigroup.com,December,2024-09-30,134506422000,None,20.26,0.784,101.91,2.15,0.0305,3.51,36.34,0.115,0.246,0.0034,0.0387,69307998000,70560000000,3.51,-0.074,-0.024,80.25,5,8,7,0,0,20.26,9.65,1.941,0.698,6.11,-,1.426,73.38,48.18,67.3,62.88,1891260000,2024-11-22,2024-11-04,71.12
BHP,Common Stock,BHP Group Limited,"BHP Group engages in the natural resources business in Australia, Europe, China, Japan, India, South Korea, the rest of Asia, North America, South America and internationally. The company is headquartered in Melbourne, Australia.",811809,NYSE,USD,USA,ENERGY & TRANSPORTATION,METAL MINING,"16/171 COLLINS STREET, MELBOURNE, VICTORIA AUSTRALIA, AU",https://www.bhp.com,June,2024-06-30,130092335000,27349000000,16.4,0,8.84,1.46,0.0573,3.11,22.11,0.141,0.427,0.14,0.197,56027001000,43235000000,3.11,0.077,0.013,55.8,0,3,2,0,1,16.4,10.85,2.322,2.981,2.482,5.87,0.859,65.55,49.35,54.78,56.32,2535140000,2024-10-03,2024-09-13,51.32
BSX,Common Stock,Boston Scientific Corp,"Boston Scientific Corporation, doing business as Boston Scientific, is a manufacturer of medical devices used in interventional medical specialties, including interventional radiology, interventional cardiology, peripheral interventions, neuromodulation, neurovascular intervention, electrophysiology, cardiac surgery, vascular surgery, endoscopy, oncology, urology and gynecology.",885725,NYSE,USD,USA,LIFE SCIENCES,SURGICAL & MEDICAL INSTRUMENTS & APPARATUS,"300 BOSTON SCIENTIFIC WAY, MARLBOROUGH, MA, US",https://www.bostonscientific.com,December,2024-09-30,133278450000,4063000000,74.74,1.639,14.05,None,None,1.21,10.83,0.113,0.171,0.049,0.0892,15911000000,8679000000,1.21,-0.063,0.193,98.62,8,20,5,0,0,74.74,32.26,8.38,6.44,8.93,38.12,0.797,91.93,54.95,87.98,78.36,1473830000,None,None,90.43
TTE,Common Stock,TotalEnergies SE ADR,"TotalEnergies SE is a global integrated oil and gas company. The company is headquartered in Paris, France.",879764,NYSE,USD,USA,ENERGY & TRANSPORTATION,CRUDE PETROLEUM & NATURAL GAS,"2 PLACE JEAN MILLIER, LA DEFENSE 6, COURBEVOIE, FR",https://www.totalenergies.com,December,2024-09-30,123906458000,37746999000,7.65,7.12,50.89,3.621,0.0613,7.09,87.28,0.083,0.116,0.0531,0.144,203260002000,92261000000,7.09,-0.648,-0.128,75.76,3,3,4,0,0,7.65,6.6,0.61,1.054,0.747,3.418,0.739,73.07,53.56,61.6,67.27,2254810000,2025-04-16,2024-12-31,54.95
ANET,Common Stock,Arista Networks,"Arista Networks (formerly Arastra) is an American computer networking company headquartered in Santa Clara, California. The company designs and sells multilayer network switches to deliver software-defined networking (SDN) solutions for large datacenter, cloud computing, high-performance computing, and high-frequency trading environments.",1596532,NYSE,USD,USA,TECHNOLOGY,COMPUTER COMMUNICATIONS EQUIPMENT,"5453 GREAT AMERICA PARKWAY, SANTA CLARA, CA, US",https://www.arista.com,December,2024-09-30,142289895000,2833342000,54.3,2.624,29.37,None,None,2.08,21.11,0.403,0.434,0.159,0.338,6613147000,2675696000,2.08,0.355,0.2,108.48,7,12,4,1,1,54.3,45.87,21.52,15.39,20.85,48.45,1.077,116.94,56.65,101.43,85.44,1259760000,None,None,112.95
PANW,Common Stock,Palo Alto Networks Inc,"Palo Alto Networks, Inc. provides cybersecurity platform solutions globally. The company is headquartered in Santa Clara, California.",1327567,NASDAQ,USD,USA,TECHNOLOGY,"COMPUTER PERIPHERAL EQUIPMENT, NEC","4401 GREAT AMERICA PARKWAY, SANTA CLARA, CA, US",https://www.paloaltonetworks.com,July,2024-10-31,132053688000,1094400000,52.27,1.457,15.9,None,None,3.85,25.15,0.321,0.12,0.0322,0.745,8027500000,3782800000,3.85,0.591,0.121,203.52,12,29,11,2,0,52.27,31.65,16.45,22.48,15.75,94.52,1.118,207.24,130.04,190.71,165.56,656200000,None,None,201.24
DE,Common Stock,Deere & Company,"John Deere is the brand name of Deere & Company, an American corporation that manufactures agricultural, construction, and forestry machinery, diesel engines, drivetrains (axles, transmissions, gearboxes) used in heavy equipment, and lawn care equipment.",315189,NYSE,USD,USA,TECHNOLOGY,FARM MACHINERY & EQUIPMENT,"ONE JOHN DEERE PLACE, MOLINE, IL, US",https://www.deere.com,October,2024-10-31,120467956000,14364000000,17.3,2.24,84.29,0,0.0145,25.64,200.39,0.147,0.19,0.0786,0.355,55955001000,21117000000,25.64,-0.383,-0.168,460.48,5,7,11,0,1,17.3,22.83,2.153,5.28,3.513,12.09,0.935,469.39,339.0,420.06,393.37,271575000,2025-02-10,2024-09-30,443.59
ADP,Common Stock,Automatic Data Processing Inc,"Automatic Data Processing, Inc. (ADP) is an American provider of human resources management software and services.",8670,NASDAQ,USD,USA,TECHNOLOGY,SERVICES-COMPUTER PROCESSING & DATA PREPARATION,"ONE ADP BOULVARD, ROSELAND, NJ, US",https://www.adp.com,June,2024-09-30,120937308000,5733100000,None,2.688,13.12,6.16,0.0208,9.35,47.66,0.197,0.265,0.0654,0.873,19522900000,8510000000,9.35,0.125,0.071,296.88,2,2,14,0,1,-,29.59,6.17,22.61,6.66,20.55,0.795,308.03,222.24,296.59,263.94,407457000,2025-01-01,2024-12-13,296.81
FI,Common Stock,"Fiserv, Inc.","Frank's International NV, provides various tubular engineering services for oil and gas exploration and production, and oilfield service companies in the United States, Europe, the Middle East, Africa, Latin America, Asia Pacific and internationally. The company is headquartered in Den Helder, the Netherlands.",798354,NYSE,USD,USA,TECHNOLOGY,SERVICES-COMPUTER PROCESSING & DATA PREPARATION,"255 FISERV DR, PO BOX 979, BROOKFIELD, WI, US",https://www.fiserv.com,December,2024-09-30,116144808000,8766000000,39.34,1.384,48.69,None,None,5.19,34.31,0.152,0.307,0.0432,0.106,20121999000,9745000000,5.19,-0.372,0.07,226.79,10,21,7,0,1,39.34,20.08,5.77,4.185,7.0,16.16,0.919,223.23,131.41,205.45,170.05,568919000,2017-09-15,2017-08-29,204.15
LMT,Common Stock,Lockheed Martin Corporation,"Lockheed Martin Corporation is an American aerospace, defense, information security, and technology company with worldwide interests. It is headquartered in North Bethesda, Maryland, in the Washington, D.C., area.",936468,NYSE,USD,USA,MANUFACTURING,GUIDED MISSILES & SPACE VEHICLES & PARTS,"6801 ROCKLEDGE DR, BETHESDA, MD, US",https://www.lockheedmartin.com,December,2024-09-30,116291740000,10226000000,17.76,4.023,30.51,12.6,0.0268,27.63,296.57,0.0936,0.127,0.0999,0.81,71295001000,8387000000,27.63,0.01,0.013,597.64,2,8,11,0,2,17.76,17.3,1.631,16.19,1.861,12.77,0.481,615.09,403.36,552.04,509.19,237035000,2024-12-27,2024-12-02,490.61
COP,Common Stock,ConocoPhillips,"ConocoPhillips is an American multinational corporation engaged in hydrocarbon exploration. It is based in the Energy Corridor district of Houston, Texas.",1163165,NYSE,USD,USA,ENERGY & TRANSPORTATION,PETROLEUM REFINING,"925 N. ELDRIDGE PARKWAY, HOUSTON, TX, US",https://www.conocophillips.com,December,2024-09-30,127105212000,24445999000,11.66,8.24,43.34,3.52,0.0313,8.43,48.5,0.175,0.243,0.1,0.204,56924000000,39598000000,8.43,-0.241,-0.079,133.61,8,12,6,0,0,11.66,10.83,2.233,2.582,2.54,5.54,1.22,132.44,95.75,107.61,113.87,1293560000,2024-12-02,2024-11-08,98.26
BMY,Common Stock,Bristol-Myers Squibb Company,"Bristol Myers Squibb (BMS) is an American multinational pharmaceutical company, headquartered in New York City. Bristol Myers Squibb manufactures prescription pharmaceuticals and biologics in several therapeutic areas, including cancer, AIDS, cardiovascular disease, diabetes, hepatitis, rheumatoid arthritis and psychiatric disorders.",14272,NYSE,USD,USA,LIFE SCIENCES,PHARMACEUTICAL PREPARATIONS,"430 E. 29TH STREET, 14 FLOOR, NEW YORK, NY, US",https://www.bms.com,December,2024-09-30,116924580000,19161999000,None,1.925,8.45,2.4,0.0444,-3.58,23.41,-0.153,0.185,0.0607,-0.313,47435002000,36378000000,-3.58,-0.358,0.084,60.91,4,3,18,1,0,-,7.89,2.465,6.61,3.302,30.89,0.441,61.08,38.6,55.79,49.13,2028180000,2025-02-03,2025-01-03,57.65
SONY,Common Stock,Sony Group Corp,"Sony Group Corporation designs, develops, produces and sells electronic equipment, instruments and devices for the consumer, professional and industrial markets worldwide. The company is headquartered in Tokyo, Japan.",313838,NYSE,USD,USA,MANUFACTURING,HOUSEHOLD AUDIO & VIDEO EQUIPMENT,"7-1, KONAN, 1-CHOME, MINATO-KU, TOKYO, JP",https://www.sony.com,March,2024-09-30,131973464000,1752999002000,18.26,3.81,1277.45,19,0.0057,1.19,2151.84,0.0854,0.158,0.0262,0.149,13145739362000,3140906000000,1.19,0.723,0.027,24.27,2,5,0,0,0,18.26,16.75,0.01,2.614,1.687,8.25,0.814,22.71,15.02,19.18,17.88,6017350000,2024-12-12,2024-09-30,21.93
SNY,Common Stock,Sanofi ADR,"Sanofi, a healthcare company, is engaged in the research, development, manufacture, and marketing of therapeutic solutions in the United States, Europe, and internationally. The company is headquartered in Paris, France.",1121404,NASDAQ,USD,USA,LIFE SCIENCES,PHARMACEUTICAL PREPARATIONS,"46 AVENUE DE LA GRANDE ARMEE, PARIS, FRANCE",https://www.sanofi.com,December,2024-09-30,122701390000,12502500000,25.89,0.762,58.1,0,0.0416,1.89,19.36,0.093,0.288,0.0416,0.0582,48445002000,31697000000,1.89,0.115,0.115,63.06,2,5,1,0,0,25.89,10.67,2.533,1.605,2.626,14.16,0.445,58.97,45.22,50.96,50.92,2507180000,2024-06-06,2024-05-09,48.94
VRTX,Common Stock,Vertex Pharmaceuticals Inc,"Vertex Pharmaceuticals, Inc. is an American biopharmaceutical company based in Boston, Massachusetts.",875320,NASDAQ,USD,USA,LIFE SCIENCES,PHARMACEUTICAL PREPARATIONS,"50 NORTHERN AVENUE, BOSTON, MA, US",https://www.vrtx.com,December,2024-09-30,120842904000,4446600000,None,1.23,60.65,None,None,-1.88,41.19,-0.0451,0.408,0.12,-0.0298,10625800000,5323100000,-1.88,0.01,0.116,515.27,5,17,11,2,1,-,25.51,11.37,7.73,10.92,224.11,0.394,519.88,391.01,473.59,457.4,257529000,None,None,469.24
NKE,Common Stock,Nike Inc,"Nike, Inc. is an American multinational corporation that is engaged in the design, development, manufacturing, and worldwide marketing and sales of footwear, apparel, equipment, accessories, and services. The company is headquartered near Beaverton, Oregon, in the Portland metropolitan area. It is the world's largest supplier of athletic shoes and apparel and a major manufacturer of sports equipment.",320187,NYSE,USD,USA,MANUFACTURING,RUBBER & PLASTICS FOOTWEAR,"ONE BOWERMAN DR, BEAVERTON, OR, US",https://www.nike.com,May,2024-08-31,116102996000,7201000000,22.35,3.947,9.35,1.48,0.0207,3.49,33.12,0.106,0.104,0.106,0.38,50012000000,21479000000,3.49,-0.255,-0.104,89.51,5,15,17,1,1,22.35,28.41,2.321,8.24,2.334,17.27,1.035,121.21,70.07,78.49,84.99,1190600000,2025-01-02,2024-12-02,97.52
GILD,Common Stock,Gilead Sciences Inc,"Gilead Sciences, Inc. is an American biopharmaceutical company headquartered in Foster City, California, that focuses on researching and developing antiviral drugs used in the treatment of HIV, hepatitis B, hepatitis C, and influenza, including Harvoni and Sovaldi.",882095,NASDAQ,USD,USA,LIFE SCIENCES,"BIOLOGICAL PRODUCTS, (NO DISGNOSTIC SUBSTANCES)","333 LAKESIDE DR, FOSTER CITY, CA, US",https://www.gilead.com,December,2024-09-30,115653853000,13949000000,1031.11,0.535,14.83,3.06,0.0332,0.09,22.7,0.0045,0.42,0.12,0.0056,28299000000,21624000000,0.09,-0.422,0.07,98.92,5,14,13,0,0,1031.11,12.33,4.087,6.26,4.73,34.17,0.192,98.08,60.24,89.95,76.61,1246270000,2024-12-30,2024-12-13,92.80
CB,Common Stock,Chubb Ltd,"Chubb Limited, incorporated in Zurich, Switzerland, is the parent company of Chubb, a global provider of insurance products covering property and casualty, accident and health, reinsurance, and life insurance and the largest publicly traded property and casualty company in the world.",896159,NYSE,USD,USA,FINANCE,"FIRE, MARINE & CASUALTY INSURANCE","BARENGASSE 32, ZURICH CH-8001, CH",https://www.chubb.com/us-en,December,2024-09-30,111533179000,11363000000,11.34,3.438,163.16,3.54,0.0132,24.4,134.95,0.183,0.196,0.0292,0.161,54697001000,10626000000,24.4,0.152,0.078,300.8,7,4,9,0,3,11.34,11.35,2.039,1.69,2.366,-,0.681,301.05,214.05,285.15,269.96,403098000,2025-01-03,2024-12-13,276.69
SBUX,Common Stock,Starbucks Corporation,"Starbucks Corporation is an American multinational chain of coffeehouses and roastery reserves headquartered in Seattle, Washington. As the world's largest coffeehouse chain, Starbucks is seen to be the main representation of the United States' second wave of coffee culture.",829224,NASDAQ,USD,USA,TRADE & SERVICES,RETAIL-EATING & DRINKING PLACES,"P O BOX 34067, SEATTLE, WA, US",https://www.starbucks.com,September,2024-09-30,104411636000,6700000000,27.82,1.863,-6.57,2.32,0.0262,3.31,31.81,0.104,0.133,0.105,0,36176200000,8385400000,3.31,-0.246,-0.032,103.3,7,11,13,3,1,27.82,28.82,2.886,-,3.502,17.78,0.962,103.32,70.4,98.07,88.24,1133800000,2025-02-28,2025-02-14,92.09
MMC,Common Stock,Marsh & McLennan Companies Inc,"Marsh McLennan (formerly known as Marsh & McLennan Companies) is a global professional services firm, headquartered in New York City with businesses in insurance brokerage, risk management, reinsurance services, talent management, investment advisory, and management consulting. Its four main operating companies are Marsh, Guy Carpenter, Mercer, and Oliver Wyman.",62709,NYSE,USD,USA,FINANCE,"INSURANCE AGENTS, BROKERS & SERVICE","1166 AVENUE OF THE AMERICAS, NEW YORK, NY, US",https://www.mmc.com,December,2024-09-30,104697381000,7246000000,26.32,2.256,27.88,3.05,0.0153,8.1,48.62,0.168,0.21,0.0832,0.321,23945001000,8884000000,8.1,0.027,0.059,231.78,2,3,12,0,3,26.32,22.12,4.372,7.65,4.915,17.13,0.937,235.5,181.9,223.7,215.62,491122000,2024-11-15,2024-10-04,213.18
UPS,Common Stock,United Parcel Service Inc,United Parcel Service is an American multinational shipping & receiving and supply chain management company founded in 1907.,1090727,NYSE,USD,USA,ENERGY & TRANSPORTATION,TRUCKING & COURIER SERVICES (NO AIR),"55 GLENLAKE PARKWAY NE, ATLANTA, GA, US",https://www.ups.com,December,2024-09-30,108651069000,12007999000,19.23,1.624,19.76,6.51,0.0512,6.62,105.94,0.0625,0.0922,0.0763,0.314,90685997000,25086000000,6.62,0.374,0.056,149.17,2,13,12,1,2,19.23,14.53,1.198,6.45,1.421,10.94,0.982,154.05,120.09,132.79,137.46,731370000,2024-12-05,2024-11-18,148.56
BA,Common Stock,The Boeing Company,"The Boeing Company is an American multinational corporation that designs, manufactures, and sells airplanes, rotorcraft, rockets, satellites, telecommunications equipment, and missiles worldwide. The company also provides leasing and product support services.",12927,NYSE,USD,USA,MANUFACTURING,AIRCRAFT,"P O BOX 3707 MS 1F 31, SEATTLE, WA, US",https://www.boeing.com,December,2024-09-30,129456890000,-3991000064,None,6.53,-38.12,None,None,-12.94,119.34,-0.109,-0.314,-0.0267,0,73292997000,5768000000,-12.94,-0.68,-0.015,182.21,4,12,10,2,0,-,36.9,1.766,-,2.41,111.56,1.572,267.54,137.03,153.19,170.46,748176000,2020-03-06,2020-02-13,173.03
APP,Common Stock,Applovin Corp,"AppLovin Corporation is committed to creating a software-based platform for mobile application developers to improve the marketing and monetization of their applications globally. The company is headquartered in Palo Alto, California.",1751008,NASDAQ,USD,USA,TECHNOLOGY,"SERVICES-COMPUTER PROGRAMMING, DATA PROCESSING, ETC.","1100 PAGE MILL RD, PALO ALTO, CA, US",https://www.applovin.com,December,2024-09-30,113393189000,1975994000,103.02,2.325,2.797,None,None,3.28,12.76,0.269,0.446,0.184,1.133,4289730000,1613993000,3.28,3.127,0.386,338.6,3,16,6,0,0,103.02,46.51,26.43,120.86,27.12,58.89,1.862,417.63,37.4,246.29,124.16,298668000,None,None,379.66
UBS,Common Stock,UBS Group AG,"UBS Group AG, provides advice and financial solutions to private, institutional and corporate clients worldwide. The company is headquartered in Zurich, Switzerland.",1610520,NYSE,USD,USA,FINANCE,NATIONAL COMMERCIAL BANKS,"BAHNHOFSTRASSE 45, ZURICH, CH",https://www.ubs.com,December,2024-09-30,100031291000,None,24.53,0.399,27.32,0.7,0.011,1.28,14.71,0.0957,0.248,0.0028,0.0528,47206998000,34415000000,1.28,-0.96,0.067,32.92,0,1,2,0,0,24.53,14.81,2.119,1.165,6.92,-,0.995,33.34,25.86,32.02,30.53,3185710000,2024-05-03,2024-05-01,31.40
MDT,Common Stock,Medtronic PLC,"Medtronic plc is an American-Irish registered medical device company that primarily operates in the United States. Medtronic has an operational and executive headquarters in Fridley, Minnesota in the US.",1613103,NYSE,USD,USA,LIFE SCIENCES,ELECTROMEDICAL & ELECTROTHERAPEUTIC APPARATUS,"20 ON HATCH, LOWER HATCH STREET, DUBLIN, IE",https://www.medtronic.com,April,2024-10-31,104339948000,9013000000,24.88,1.486,38.29,0,0.032,3.27,24.71,0.121,0.175,0.0442,0.0795,32576999000,21715000000,3.27,0.356,0.028,96.19,6,11,14,1,1,24.88,14.93,3.203,2.152,3.779,14.56,0.853,92.68,75.37,87.56,84.45,1282290000,2025-01-10,2024-09-27,81.37
ADI,Common Stock,Analog Devices Inc,"Analog Devices, Inc. (ADI), also known simply as Analog, is an American multinational semiconductor company specializing in data conversion, signal processing and power management technology, headquartered in Wilmington, Massachusetts.",6281,NASDAQ,USD,USA,MANUFACTURING,SEMICONDUCTORS & RELATED DEVICES,"ONE TECHNOLOGY WAY, NORWOOD, MA, US",https://www.analog.com,October,2024-10-31,106118226000,4361349000,65.39,0.987,70.88,0,0.0165,3.27,19.54,0.171,0.218,0.0286,0.0466,9700436000,7877218000,3.27,-0.546,-0.248,251.9,4,14,14,0,0,65.39,29.59,10.94,3.017,11.82,26.5,1.078,242.09,178.73,222.16,217.84,496297000,2024-12-20,2024-09-03,213.82
MU,Common Stock,Micron Technology Inc,"Micron Technology, Inc. is an American producer of computer memory and computer data storage including dynamic random-access memory, flash memory, and USB flash drives. It is headquartered in Boise, Idaho.",723125,NASDAQ,USD,USA,MANUFACTURING,SEMICONDUCTORS & RELATED DEVICES,"8000 S FEDERAL WAY, PO BOX 6, BOISE, ID, US",https://www.micron.com,August,2024-08-31,120984748000,8944000000,155.14,0.173,40.7,0.46,0.0042,0.7,22.73,0.031,0.197,0.0117,0.0174,25110999000,-1416000000,0.7,-0.432,0.933,145.92,9,27,2,0,1,155.14,12.22,4.818,2.681,5.05,13.24,1.179,157.22,78.92,103.78,110.78,1114040000,2024-10-23,2024-10-07,108.60
IBN,Common Stock,ICICI Bank Limited,"ICICI Bank Limited offers various banking products and financial services in India and internationally. The company is headquartered in Mumbai, India.",None,NYSE,USD,USA,TECHNOLOGY,GENERAL,NONE,https://www.icicibank.com,March,2024-09-30,110855873000,None,19.87,0,397.44,0,0.0077,1.56,466.49,0.289,0.375,0.0216,0.187,1638509183000,1286954800000,1.56,0.182,0.274,36.2,1,3,0,0,0,19.87,18.35,0.0677,3.316,6.35,-,0.829,32.14,22.96,30.22,28.38,3529010000,2024-09-06,2024-08-12,31.41
PLD,Common Stock,Prologis Inc,"Prologis, Inc. is a real estate investment trust headquartered in San Francisco, California that invests in logistics facilities, with a focus on the consumption side of the global supply chain.",1045609,NYSE,USD,USA,REAL ESTATE & CONSTRUCTION,REAL ESTATE INVESTMENT TRUSTS,"PIER 1 BAY 1, SAN FRANCISCO, CA, US",https://www.prologis.com,December,2024-09-30,100832674000,5739132000,32.89,0.494,57.23,3.75,0.0353,3.31,8.9,0.374,0.41,0.0211,0.0566,8239210000,4775470000,3.31,0.343,0.068,130.33,5,8,9,0,0,32.89,41.32,12.24,1.902,16.78,19.57,1.094,131.48,98.65,116.27,118.55,926175000,2024-12-31,2024-12-16,108.87
RACE,Common Stock,Ferrari NV,"Ferrari NV designs, designs, produces and sells high performance sports cars. The company is headquartered in Maranello, Italy.",1648416,NYSE,USD,USA,MANUFACTURING,MOTOR VEHICLES & PASSENGER CAR BODIES,"VIA ABETONE INFERIORE N. 4, MARANELLO, IT",https://www.ferrari.com,December,2024-09-30,79109341000,2095879000,51.84,3.536,18.6,2.443,0.0061,8.34,35.9,0.221,0.282,0.132,0.464,6464527000,2446301000,8.34,0.143,0.065,494.42,4,6,3,0,1,51.84,45.87,12.24,22.07,11.73,30.35,0.992,498.23,328.05,455.56,437.9,179104000,2024-05-03,2024-04-22,441.69
INTC,Common Stock,Intel Corporation,"Intel Corporation is an American multinational corporation and technology company headquartered in Santa Clara, California, in Silicon Valley. It is the world's largest semiconductor chip manufacturer by revenue, and is the developer of the x86 series of microprocessors, the processors found in most personal computers (PCs).",50863,NASDAQ,USD,USA,MANUFACTURING,SEMICONDUCTORS & RELATED DEVICES,"2200 MISSION COLLEGE BLVD, RNB-4-151, SANTA CLARA, CA, US",https://www.intel.com,December,2024-09-30,88157725000,10439000000,None,0.582,23.1,0.495,0.0224,-3.74,12.75,-0.294,-0.0105,-0.0026,-0.156,54246998000,26866000000,-3.74,-0.717,-0.062,24.42,1,4,35,2,4,-,23.42,1.625,0.903,2.138,35.24,1.026,50.6,18.51,23.06,28.66,4313000000,2024-09-01,2024-08-07,20.44
LRCX,Common Stock,Lam Research Corp,"Lam Research Corporation is an American corporation that engages in the design, manufacture, marketing, and service of semiconductor processing equipment used in the fabrication of integrated circuits. Its products are used primarily in front-end wafer processing, which involves the steps that create the active components of semiconductor devices (transistors, capacitors) and their wiring (interconnects). The company also builds equipment for back-end wafer-level packaging (WLP), and for related manufacturing markets such as for microelectromechanical systems (MEMS). The company is headquartered in Fremont, California, in the Silicon Valley.",707549,NASDAQ,USD,USA,TECHNOLOGY,"SPECIAL INDUSTRY MACHINERY, NEC","4650 CUSHING BLVD, FREMONT, CA, US",https://www.lamresearch.com,June,2024-09-30,100117348000,4920197000,25.18,1.5,6.56,0.83,0.0118,3.09,11.93,0.26,0.303,0.15,0.491,15591300000,7871807000,3.09,0.284,0.197,92.98,4,16,12,0,0,25.18,21.14,6.42,11.82,6.35,19.13,1.486,112.31,68.66,75.9,87.71,1286690000,2025-01-08,2024-12-11,77.81
SHW,Common Stock,Sherwin-Williams Co,"Sherwin Williams Company is a Cleveland, Ohio based company in the paint and coating manufacturing industry. The company primarily engages in the manufacture, distribution, and sale of paints, coatings, floorcoverings, and related products to professional, industrial, commercial, and retail customers primarily in North and South America and Europe.",89800,NYSE,USD,USA,TRADE & SERVICES,"RETAIL-BUILDING MATERIALS, HARDWARE, GARDEN SUPPLY","101 PROSPECT AVE NW, CLEVELAND, OH, US",https://www.sherwin-williams.com,December,2024-09-30,91369751000,4399800000,36.13,3.374,16.59,2.75,0.0078,10.04,91.47,0.111,0.184,0.101,0.644,23053500000,9325100000,10.04,0.078,0.007,386.49,5,10,12,1,1,36.13,28.33,3.963,21.98,4.478,23.79,1.175,400.42,281.01,378.51,343.59,251853000,2024-12-06,2024-11-15,362.79
